,,,,,,,,,,,,,,,,,,,,,,,,,,,,,,,,,,,,,,,,,,,,,,,,,,20/12/2017,,,,,,,,,,,,,,0.03,,,,,,,,,,,,,,,,,,6,6,,,,No planning history to date.,,,,,,local-authority-eng:WOI,,not owned by a public authority,,,,,,,,,,not permissioned,,,,,,,,,,,,,,,,,,,,,,,SHLAACAN043,"""3a-4 The Broadway, Woking, GU21 5AP""",http://www.woking2027.info/ldfregisters,,,20/12/2017,,,,,,,,,,,,,,,,,,,,,,,,,,
,,,,,,,,,,,,,,,,,,,,,,,,,,,,,,,,,,,,,,,,,,,,,,,,,,20/12/2017,,,,,,,,,,,,,,0.02,,,,,,,,,,,,,,,,,,7,7,,,,No planning history to date.,,,,,,local-authority-eng:WOI,,not owned by a public authority,,,,,,,,,,not permissioned,,,,,,,,,,,,,,,,,,,,,,,SHLAACAN044,"""Offices above 1 Chertsey Road, Woking, GU21 5AB""",http://www.woking2027.info/ldfregisters,,,20/12/2017,,,,,,,,,,,,,,,,,,,,,,,,,,
,,,,,,,,,,,,,,,,,,,,,,,,,,,,,,,,,,,,,,,,,,,,,,,,,,20/12/2017,,,,,,,,,,,,,,0.01,,,,,,,,,,,,,,,,,,5,5,,,,No planning history to date.,,,,,,local-authority-eng:WOI,,,,,,,,,,,,not permissioned,,,,,,,,,,,,,,,,,,,,,,,SHLAACAN045,"""Railway House, 14 Chertsey Road, Woking, GU21 5AH""",http://www.woking2027.info/ldfregisters,,,20/12/2017,,,,,,,,,,,,,,,,,,,,,,,,,,
,,,,,,,,,,,,,,,,,,,,,,,,,,,,,,,,,,,,,,,,,,,,,,,,,,20/12/2017,,,,,,,,,,,,,,0.11,,,,,,,,,,,,,,,,,,5,5,,,,"PLAN/2016/0265 small scale application for coversion of garage to habitable accommodation. The min net dwelling figure is very much a lower estimate for this site, and is based upon the indicative density given in the SHLAA Methodology Appendix 4.",,,,,,local-authority-eng:WOI,,owned by a public authority,,,,,,,,,,not permissioned,,,,,,,,,,,,,,,,,,,,,,,SHLAAHOR008,"""Garage sites around Horsell Park and Graylands Close, Horsell, GU21 4LZ""",http://www.woking2027.info/ldfregisters,,,20/12/2017,,,,,,,,,,,,,,,,,,,,,,,,,,
,,,,,,,,,,,,,,,,,,,,,,,,,,,,,,,,,,,,,,,,,,,,,,,,,,20/12/2017,,,,,,,,,,,,,,0.14,,,,,,,,,,,,,,,,,,5,5,,,,No planning history to date.,,,,,,local-authority-eng:WOI,,not owned by a public authority,,,,,,,,,,not permissioned,,,,,,,,,,,,,,,,,,,,,,,SHLAAPYR009,"""The Princess of Wales Public House, 24, Princess Road, Woking, GU22 8EN""",http://www.woking2027.info/ldfregisters,,,20/12/2017,,,,,,,,,,,,,,,,,,,,,,,,,,
,,,,,,,,,,,,,,,,,,,,,,,,,yes,,,,,,,,,,,,,,,,,,,,,,,,,20/12/2017,,,,,,,,,,,,,,0.04,,,,,,,,,,,,,,,,,,13,13,,,,"PLAN/2017/0070 prior approval given in DevelopmentDescription.  In this case, the min net dwellings is based on indicative density from the SHLAA Methodology 2017 Appendix 4 rather than the prior notification. Also PLAN/2017/0583: Proposed re-fenestration of upper floors of building to facilitate implementation of prior approval for residential use [Plan/2017/0070] and the construction of a new service core, infilling of ground floor and small rear extension to allow: the creation of an additional retail unit at ground floor level, both ground floor units to be in flexible retail use [A1, A2 and A3]",,,,,,local-authority-eng:WOI,,not owned by a public authority,,,,,,,,2017-03-14,https://www.woking.gov.uk/planning/publicaccess,permissioned,full planning permission,,,,,,,,,,,,,,,,,,,,,,SHLAACAN007,"""Regent House, 19-20, The Broadway, Woking, GU21 5AP""",http://www.woking2027.info/ldfregisters,,,20/12/2017,,,,,,,,,,,,,,,,,,,,,,,,,,
,,,,,,,,,,,,,,,,,,,,,,,,,,,,,,,,,,,,,,,,,,,,,,,,,,20/12/2017,,,,,,,,,,,,,,0.32,,,,,,,,,,,,,,,,,,30,30,,,,"PLAN/2017/0317 detailed is not for residential use, but for a car show room. However the site has potential for residential development and the min net dwellings is based on indicative density from the SHLAA Methodology 2017 Appendix 4.",,,,,,local-authority-eng:WOI,,not owned by a public authority,,,,,,,,2017-05-24,https://www.woking.gov.uk/planning/publicaccess,permissioned,full planning permission,,,,,,,,,,,,,,,,,,,,,,SHLAACAN015,"""33-35 Portugal Road, Woking, GU21 5JE""",http://www.woking2027.info/ldfregisters,,,20/12/2017,,,,,,,,,,,,,,,,,,,,,,,,,,
,,,,,,,,,,,,,,,,,,,,,,,,,,,,,,,,,,,,,,,,,,,,,,,,,,20/12/2017,,,,,,,,,,,,,,0.08,,,,,,,,,,,,,,,,,,16,16,,,,"No min net dwelling figure is given as this is yet to be confirmed. The min net dwelling figure is very much a lower estimate for this site, and is based on the lower range density given in the SHLAA Methodology Appendix 4.",,,,,,local-authority-eng:WOI,,not owned by a public authority,,,,,,,,,,not permissioned,,,,,,,,,,,,,,,,,,,,,,,SHLAACAN024,"""Griffin House, West Street, Woking, GU21 6BS""",http://www.woking2027.info/ldfregisters,,,20/12/2017,,,,,,,,,,,,,,,,,,,,,,,,,,
,,,,,,,,,,,,,,,,,,,,,,,,,yes,,,,,,,,,,,,,,,,,,,,,,,,,20/12/2017,,,,,,,,,,,,,,0.04,,,,,,,,,,,,,,,,,,13,13,,,,"PLAN/2017/0820 shown in DevelopmentDescription.  In this case, the min net dwellings is based on indicative density from the SHLAA Methodology 2017 Appendix 4 rather than the current prior approval.",,,,,,local-authority-eng:WOI,,not owned by a public authority,,,,,,,,2017-08-25,https://www.woking.gov.uk/planning/publicaccess,permissioned,full planning permission,,,,,,,,,,,,,,,,,,,,,,SHLAACAN036,"""McDonalds, 11-17 Chertsey Road, Woking, GU21 5AB""",http://www.woking2027.info/ldfregisters,,,20/12/2017,,,,,,,,,,,,,,,,,,,,,,,,,,
,,,,,,,,,,,,,,,,,,,,,,,,,,,,,,,,,,,,,,,,,,,,,,,,,,20/12/2017,,,,,,,,,,,,,,0.12,,,,,,,,,,,,,,,,,,11,11,,,,"PLAN/2016/0412 pending decision, resolution to grant.",,,,,,local-authority-eng:WOI,,not owned by a public authority,,,,,,,,,https://www.woking.gov.uk/planning/publicaccess,pending decision,full planning permission,,,,,,,,,,,,,,,,,,,,,,SHLAACAN037,"""Parrington Autos, rear of 12 and 12-16, Portugal Road, Maybury, GU21 5JE""",http://www.woking2027.info/ldfregisters,,,20/12/2017,,,,,,,,,,,,,,,,,,,,,,,,,,
,,,,,,,,,,,,,,,,,,,,,,,,,yes,,,,,,,,,,,,,,,,,,,,,,,,,20/12/2017,,,,,,,,,,,,,,0.07,,,,,,,,,,,,,,,,,,5,5,,,,"PLAN/2015/0101 prior approval, detailed. Also PLAN/2016/0049 9no further action) for 8 flats, and PLAN/2016/0353 (for an extension and a new building) and PLAN/2016/0743 (for 8 flats) refused",,,,,,local-authority-eng:WOI,,not owned by a public authority,,,,,,,,2015-04-02,https://www.woking.gov.uk/planning/publicaccess,permissioned,full planning permission,,,,,,,,,,,,,,,,,,,,,,SHLAACAN038,"""29 Eve Road, Woking, GU21 5JS""",http://www.woking2027.info/ldfregisters,,,20/12/2017,,,,,,,,,,,,,,,,,,,,,,,,,,
,,,,,,,,,,,,,,,,,,,,,,,,,yes,,,,,,,,,,,,,,,,,,,,,,,,,20/12/2017,,,,,,,,,,,,,,0.09,,,,,,,,,,,,,,,,,,30,30,,,,"PLAN/2016/0438 detailed in DevelopmentDescription.  In this case, the min net dwellings is based on indicative density from the SHLAA Methodology 2017 Appendix 4 rather than the current prior approval.",,,,,,local-authority-eng:WOI,,not owned by a public authority,,,,,,,,2016-06-13,https://www.woking.gov.uk/planning/publicaccess,permissioned,full planning permission,,,,,,,,,,,,,,,,,,,,,,SHLAACAN039,"""Church Gate, 9 -11 Church Street West, Woking, GU21 6DJ""",http://www.woking2027.info/ldfregisters,,,20/12/2017,,,,,,,,,,,,,,,,,,,,,,,,,,
,,,,,,,,,,,,,,,,,,,,,,,,,,,,,,,,,,,,,,,,,,,,,,,,,,20/12/2017,,,,,,,,,,,,,,0.97,,,,,,,,,,,,,,,,,,125,125,,,,"PLAN/2016/0742 mixed use application detailed.  In this case, the min net dwellings is based on indicative density derived from the SHLAA Methodology 2017 Appendix 4, and accounting for the mix of uses on the site, rather than the application detailed.",,,,,,local-authority-eng:WOI,,not owned by a public authority,,,,,,,,,https://www.woking.gov.uk/planning/publicaccess,pending decision,full planning permission,,,,,,,,,,,,,,,,,,,,,,SHLAACAN040,"""20-32 Goldsworth Road, Woking, GU21 6JT""",http://www.woking2027.info/ldfregisters,,,20/12/2017,,,,,,,,,,,,,,,,,,,,,,,,,,
,,,,,,,,,,,,,,,,,,,,,,,,,yes,,,,,,,,,,,,,,,,,,,,,,,,,20/12/2017,,,,,,,,,,,,,,0.09,,,,,,,,,,,,,,,,,,29,29,,,,PLAN/2017/0165 prior approval detailed.,,,,,,local-authority-eng:WOI,,not owned by a public authority,,,,,,,,2017-03-30,https://www.woking.gov.uk/planning/publicaccess,permissioned,full planning permission,,,,,,,,,,,,,,,,,,,,,,SHLAACAN041,"""Premier House, 15-19 Church Street West, Woking, GU21 6DJ""",http://www.woking2027.info/ldfregisters,,,20/12/2017,,,,,,,,,,,,,,,,,,,,,,,,,,
,,,,,,,,,,,,,,,,,,,,,,,,,,,,,,,,,,,,,,,,,,,,,,,,,,20/12/2017,,,,,,,,,,,,,,0.18,,,,,,,,,,,,,,,,,,6,6,,,,"PLAN/2009/0413 refused and appeal dismissed (June 2010) for 8 dwellings, as 2 units and private gardens would be overshadowed by trees. The other 6 units were acceptable.",,,,,,local-authority-eng:WOI,,owned by a public authority,,,,,,,,,https://www.woking.gov.uk/planning/publicaccess,not permissioned,,,,,,,,,,,,,,,,,,,,,,,SHLAAHOR005,"""Garages to rear of 3-9 and 11-41 Pares Close, Woking, GU21 4QL""",http://www.woking2027.info/ldfregisters,,,20/12/2017,,,,,,,,,,,,,,,,,,,,,,,,,,
,,,,,,,,,,,,,,,,,,,,,,,,,,,,,,,,,,,,,,,,,,,,,,,,,,20/12/2017,,,,,,,,,,,,,,0.59,,,,,,,,,,,,,,,,,,22,22,,,,"PLAN/2016/1204 pending decision. PLAN/2015/1438 permitted subject to legal agreement (82 bed C2 care home); PLAN/2016/0358 and PLAN/2016/0724 both withdrawn.  In this case, the min net dwellings is based on indicative density from the SHLAA Methodology 2017 Appendix 4 rather than the pending planning application.",,,,,,local-authority-eng:WOI,,not owned by a public authority,,,,,,,,,https://www.woking.gov.uk/planning/publicaccess,pending decision,full planning permission,,,,,,,,,,,,,,,,,,,,,,SHLAAHOR007,"""Britannia Wharf, Monument Road, Woking, GU21 5LW""",http://www.woking2027.info/ldfregisters,,,20/12/2017,,,,,,,,,,,,,,,,,,,,,,,,,,
,,,,,,,,,,,,,,,,,,,,,,,,,yes,,,,,,,,,,,,,,,,,,,,,,,,,20/12/2017,,,,,,,,,,,,,,0.47,,,,,,,,,,,,,,,,,,18,18,,,,"PLAN/2016/0877 detailed in DevelopmentDescription.  In this case, the min net dwellings is based on indicative density from the SHLAA Methodology 2017 Appendix 4 rather than the current permission.",,,,,,local-authority-eng:WOI,,not owned by a public authority,,,,,,,,2017-03-09,https://www.woking.gov.uk/planning/publicaccess,permissioned,full planning permission,,,,,,,,,,,,,,,,,,,,,,SHLAAHOR009,"""Horsell Lodge Residential Care Home, Kettlewell Hill, Woking, GU21 4JA""",http://www.woking2027.info/ldfregisters,,,20/12/2017,,,,,,,,,,,,,,,,,,,,,,,,,,
