address,address-text,addressbase-custodian,amount,attribution,billing-authority,cardinality,category,census-area,citizen-name,citizen-names,clinical-commissioning-group,collection,combined-authority,company,conservation-area,contact,contribution-funding-status,contribution-purpose,copyright,country,dataset,datatype,datetime,default-field,deliverable,description,developer-agreement,developer-agreement-contribution,developer-agreement-transaction,developer-agreement-type,development-corporation,development-metric,development-plan,development-plan-document,development-plan-status,development-plan-timetable,development-plan-type,development-policies,development-policy,development-policy-area,development-policy-categories,development-policy-category,document,document-url,documentation-url,elapsed,end-date,endpoint,endpoint-url,entry-date,esd-inventory,field,fields,further-education-college-region-uk,further-education-college-uk,geography,geographies,geometry,government-domain,government-organisation,government-service,hash,hazardous-substances,hectares,hostname,identifier,internal-drainage-board,item,jobcentre,jobcentre-district,jobcentre-group,json,key-field,legal-instrument,legislation,licence,local-authority-eng,local-authority-nir,local-authority-sct,local-authority-type,local-resilience-forum,maximum-net-dwellings,minimum-net-dwellings,name,name-cy,national-park-authority,notes,number,official-name,official-name-cy,opendatacommunities-area,opendatacommunities-organisation,organisation,organisations,ownership-status,parameter,parameters,parent-field,pattern,phase,pipeline,planning-application,planning-permission-date,planning-permission-history,planning-permission-status,planning-permission-type,plugin,point,principal-local-authority,prison-estate,provenance,public-authority,purpose,region,regional-park-authority,register,registration-district,registry,replacement-field,request-headers,resource,response-headers,schema,school-type-eng,separator,shielding-hub,short-name,site,site-address,site-plan-url,source,specification,start-date,statistical-geographies,statistical-geography,statistical-geography-county-eng,statistical-geography-local-government-district-nir,statistical-geography-london-borough-eng,statistical-geography-metropolitan-district-eng,statistical-geography-non-metropolitan-district-eng,statistical-geography-registration-district-eng,statistical-geography-registration-district-wls,statistical-geography-unitary-authority-eng,statistical-geography-unitary-authority-wls,status,strategic,street,string,territory,text,transport-authority,twitter,typology,uk,units,url,value,website,wikidata-item
,,,,,,,,,,,,,,,,,,,,,,,,,yes,,,,,,,,,,,,,,,,,,,,,,,,,2017-12-18,,,,,,,,,,,,,,1.03,,,,,,,,,,,,,,,,,,29,25,,,,The calculation used for net minimum (and net dwelling range from) is 60% of the site area multiplied by minimum indicative density (Policy HO7) (in this case 40 dwellings per hectare). The calculation used for net dwelling range to is 70% of the site area multiplied by the same minimum indicative density.,,,,,,local-authority-eng:NNO,,not owned by a public authority,,,,,,,,,,not permissioned,,,,,,,,,,,,,,,,,,,,,,,BLR01,Land at Runton Road Cromer,https://www.north-norfolk.gov.uk/media/3776/blr01-map.jpg,,,2017-12-18,,,,,,,,,,,,,,,,,,,,,,,,,,
,,,,,,,,,,,,,,,,,,,,,,,,,yes,,,,,,,,,,,,,,,,,,,,,,,,,2017-12-18,,,,,,,,,,,,,,0.21,,,,,,,,,,,,,,,,,,7,7,,,,,,,,,,local-authority-eng:NNO,,not owned by a public authority,,,,,,,,2013-09-27,https://idoxpa.north-norfolk.gov.uk/online-applications/applicationDetails.do?activeTab=documents&keyVal=_NNORF_DCAPR_81584多ttps://idoxpa.north-norfolk.gov.uk/online-applications/applicationDetails.do?activeTab=summary&keyVal=_NNORF_DCAPR_50197,permissioned,full planning permission,,,,,,,,,,,,,,,,,,,,,,BLR02,Coach Depot Claypit Lane Fakenham,https://www.north-norfolk.gov.uk/media/3777/blr02-map.jpg,,,2017-12-18,,,,,,,,,,,,,,,,,,,,,,,,,,
,,,,,,,,,,,,,,,,,,,,,,,,,,,,,,,,,,,,,,,,,,,,,,,,,,2017-12-18,,,,,,,,,,,,,,0.82,,,,,,,,,,,,,,,,,,23,20,,,,The calculation used for net minimum (and net dwelling range from) is 60% of the site area multiplied by minimum indicative density (Policy HO7) (in this case 40 dwellings per hectare). The calculation used for net dwelling range to is 70% of the site area multiplied by the same minimum indicative density.,,,,,,local-authority-eng:NNO,,not owned by a public authority,,,,,,,,,https://idoxpa.north-norfolk.gov.uk/online-applications/applicationDetails.do?activeTab=documents&keyVal=_NNORF_DCAPR_78356多ttps://idoxpa.north-norfolk.gov.uk/online-applications/applicationDetails.do?activeTab=documents&keyVal=_NNORF_DCAPR_78329多ttps://idoxpa.north-norfolk.gov.uk/online-applications/applicationDetails.do?activeTab=documents&keyVal=_NNORF_DCAPR_79602,not permissioned,,,,,,,,,,,,,,,,,,,,,,,BLR03,Maces Yard 34 - 36 Cromer Road North Walsham,https://www.north-norfolk.gov.uk/media/3778/blr03-map.jpg,,,2017-12-18,,,,,,,,,,,,,,,,,,,,,,,,,,
,,,,,,,,,,,,,,,,,,,,,,,,,yes,,,,,,,,,,,,,,,,,,,,,,,,,2017-12-18,,,,,,,,,,,,,,1.09,,,,,,,,,,,,,,,,,,8,8,,,,,,,,,,local-authority-eng:NNO,,not owned by a public authority,,,,,,,,2017-08-23,https://idoxpa.north-norfolk.gov.uk/online-applications/applicationDetails.do?activeTab=documents&keyVal=_NNORF_DCAPR_90826多ttps://idoxpa.north-norfolk.gov.uk/online-applications/applicationDetails.do?activeTab=summary&keyVal=_NNORF_DCAPR_90827多ttps://idoxpa.north-norfolk.gov.uk/online-applications/applicationDetails.do?activeTab=summary&keyVal=_NNORF_DCAPR_74273,permissioned,full planning permission,,,,,,,,,,,,,,,,,,,,,,BLR04,Melborne House Bacton Road North Walsham,https://www.north-norfolk.gov.uk/media/3779/blr04-map.jpg,,,2017-12-18,,,,,,,,,,,,,,,,,,,,,,,,,,
,,,,,,,,,,,,,,,,,,,,,,,,,yes,,,,,,,,,,,,,,,,,,,,,,,,,2017-12-18,,,,,,,,,,,,,,0.54,,,,,,,,,,,,,,,,,,45,45,,,,"By virtue of condition 1 of the planning permission, development must be begun not later than 1 November 2018. The planning permission is subject to pre-commencement conditions.",,,,,,local-authority-eng:NNO,,not owned by a public authority,,,,,,,,2017-10-25,https://idoxpa.north-norfolk.gov.uk/online-applications/applicationDetails.do?activeTab=summary&keyVal=_NNORF_DCAPR_90574,permissioned,full planning permission,,,,,,,,,,,,,,,,,,,,,,BLR05,29 New Road North Walsham,https://www.north-norfolk.gov.uk/media/3773/blr05-map.jpg,,,2017-12-18,,,,,,,,,,,,,,,,,,,,,,,,,,
,,,,,,,,,,,,,,,,,,,,,,,,,,,,,,,,,,,,,,,,,,,,,,,,,,2017-12-15,,,,,,,,,,,,,,0.44,,,,,,,,,,,,,,,,,,6,6,,,,"The wider site has extant permission (PM/02/0556) for 6 bungalows. There are currently 4 permissions for revised designs replacing the bungalows with one and a half, two and two and a half storey dwellings. References and expiry dates are as follows: 15/1468 one dwelling expires 09/03/19, 14/0143 two dwellings expires 29/05/19, 13/0815 two dwellings expires 22/10/18 and 13/0345 one dwelling expires 31/05/18",,,,,,local-authority-eng:NNO,,not owned by a public authority,,,,,,,,2016-03-09,https://idoxpa.north-norfolk.gov.uk/online-applications/applicationDetails.do?activeTab=summary&keyVal=_NNORF_DCAPR_86444多ttps://idoxpa.north-norfolk.gov.uk/online-applications/applicationDetails.do?activeTab=summary&keyVal=_NNORF_DCAPR_82508多ttps://idoxpa.north-norfolk.gov.uk/online-applications/applicationDetails.do?activeTab=summary&keyVal=_NNORF_DCAPR_81323多ttps://idoxpa.north-norfolk.gov.uk/online-applications/applicationDetails.do?activeTab=summary&keyVal=_NNORF_DCAPR_80703,permissioned,full planning permission,,,,,,,,,,,,,,,,,,,,,,BLR06,Land at Abbey Road Sheringham,https://www.north-norfolk.gov.uk/media/3774/blr06-map.jpg,,,2017-12-18,,,,,,,,,,,,,,,,,,,,,,,,,,
,,,,,,,,,,,,,,,,,,,,,,,,,,,,,,,,,,,,,,,,,,,,,,,,,,2017-12-18,,,,,,,,,,,,,,0.26,,,,,,,,,,,,,,,,,,7,7,,,,Demolition of the former coach depot/workshop has been undertaken under DP/14/1621.,,,,,,local-authority-eng:NNO,,not owned by a public authority,,,,,,,,2017-03-15,https://idoxpa.north-norfolk.gov.uk/online-applications/applicationDetails.do?activeTab=documents&keyVal=_NNORF_DCAPR_88420多ttps://idoxpa.north-norfolk.gov.uk/online-applications/applicationDetails.do?activeTab=documents&keyVal=_NNORF_DCAPR_84487,permissioned,outline planning permission,,,,,,,,,,,,,,,,,,,,,,BLR07,Coach Depot The Street Catfield,https://www.north-norfolk.gov.uk/media/3775/blr07-map.jpg,,,2017-12-18,,,,,,,,,,,,,,,,,,,,,,,,,,
