,,,,,,,,,,,,,,,,,,,,,,,,,,,,,,,,,,,,,,,,,,,,,,,,,,2017-12-17,,,,,,,,,,,,,,0.27,,,,,,,,,,,,,,,,,,16,16,,,,Scheme for development of 18 units following demolition permitted - 16/01201/OUT. This supersedes initial outline consent also for 18 homes - CM/20090540,,,,,,local-authority-eng:NBL,,not owned by a public authority,,,,,,,,2016-08-18,https://publicaccess.northumberland.gov.uk/online-applications/propertyDetails.do?activeTab=relatedCases&keyVal=00AUENTGLI000,permissioned,outline planning permission,,,,,,,,,,,,,,,,,,,,,,3406,"""Nordstrom House, Manor Grange, Broomhill""",http://northumberland.maps.arcgis.com/apps/webappviewer/index.html?id=c1b801d50f8040efbf8c9bc9f916cfae,,,2016-06-30,,,,,,,,,,,,,,,,,,,,,,,,,,
,,,,,,,,,,,,,,,,,,,,,,,,,yes,,,,,,,,,,,,,,,,,,,,,,,,,2017-12-17,,,,,,,,,,,,,,21.77,,,,,,,,,,,,,,,,,,237,237,,,,"Reserved matters application for 258 dwellings now pending consideration - 17/02747/REM. Outline application approved for redevelopment of Police HQ providing 263 dwellings as part of wider mixed-use scheme - 14/01442/OUT. Previous application for mixed-use scheme, including 150 homes, withdrawn - CM/20080775.",,,,,,local-authority-eng:NBL,,owned by a public authority,,,,,,,,2015-08-04,https://publicaccess.northumberland.gov.uk/online-applications/propertyDetails.do?activeTab=relatedCases&keyVal=00AUARTGLI000,permissioned,outline planning permission,,,,,,,,,,,,,,,,,,,,,,3427,"""Police HQ, Ponteland""",http://northumberland.maps.arcgis.com/apps/webappviewer/index.html?id=c1b801d50f8040efbf8c9bc9f916cfae,,,2017-12-17,,,,,,,,,,,,,,,,,,,,,,,,,,
,,,,,,,,,,,,,,,,,,,,,,,,,,,,,,,,,,,,,,,,,,,,,,,,,,2017-12-17,,,,,,,,,,,,,,1.10,,,,,,,,,,,,,,,,,,14,14,,,,No relevant planning history,,,,,,local-authority-eng:NBL,,not owned by a public authority,,,,,,,,,,not permissioned,,,,,,,,,,,,,,,,,,,,,,,3486x,"""Moorhouse Farm, Stannington Station (brownfield parcel)""",http://northumberland.maps.arcgis.com/apps/webappviewer/index.html?id=c1b801d50f8040efbf8c9bc9f916cfae,,,2017-12-17,,,,,,,,,,,,,,,,,,,,,,,,,,
,,,,,,,,,,,,,,,,,,,,,,,,,,,,,,,,,,,,,,,,,,,,,,,,,,2017-12-17,,,,,,,,,,,,,,7.55,,,,,,,,,,,,,,,,,,134,134,,,,Outline consent approved for mixed-use scheme including construction of 149 houses - CM/20090001. Previous outline consent for 26 homes not progressed - CM/20061042. Original proposal for 36 units refused - 05/D/773,,,,,,local-authority-eng:NBL,,,,,,,,,,2015-05-07,https://publicaccess.northumberland.gov.uk/online-applications/propertyDetails.do?activeTab=relatedCases&keyVal=00AW09TGLI000,permissioned,outline planning permission,,,,,,,,,,,,,,,,,,,,,,3491,"""Stobswood Brickworks, Stobswood""",http://northumberland.maps.arcgis.com/apps/webappviewer/index.html?id=c1b801d50f8040efbf8c9bc9f916cfae,,,2016-06-30,,,,,,,,,,,,,,,,,,,,,,,,,,
,,,,,,,,,,,,,,,,,,,,,,,,,yes,,,,,,,,,,,,,,,,,,,,,,,,,2018-12-31,,,,,,,,,,,,,,3.28,,,,,,,,,,,,,,,,,,32,32,,,,Outline permission for redevelopment of site for up to 85 residential dwellings permitted July 2017 - 14/00808/OUT,,,,,,local-authority-eng:NBL,,,,,,,,,,2017-07-07,https://publicaccess.northumberland.gov.uk/online-applications/propertyDetails.do?activeTab=relatedCases&keyVal=MTFJBXQS0CE00,permissioned,outline planning permission,,,,,,,,,,,,,,,,,,,,,,3500x,"""Netherton Park (land at) (brownfield parcel)""",http://northumberland.maps.arcgis.com/apps/webappviewer/index.html?id=c1b801d50f8040efbf8c9bc9f916cfae,,,2017-12-17,,,,,,,,,,,,,,,,,,,,,,,,,,
,,,,,,,,,,,,,,,,,,,,,,,,,,,,,,,,,,,,,,,,,,,,,,,,,,2017-12-17,,,,,,,,,,,,,,0.28,,,,,,,,,,,,,,,,,,6,6,,,,Previous planning consent for construction of 3 three-bed houses and 4 two-bed bungalows has lapsed - CM/20080381,,,,,,local-authority-eng:NBL,,not owned by a public authority,,,,,,,,2008-07-14,https://publicaccess.northumberland.gov.uk/online-applications/propertyDetails.do?activeTab=relatedCases&keyVal=00AZFJTGLI000,not permissioned,,,,,,,,,,,,,,,,,,,,,,,3549,"""Druridge Avenue, Hadston""",http://northumberland.maps.arcgis.com/apps/webappviewer/index.html?id=c1b801d50f8040efbf8c9bc9f916cfae,,,2016-06-30,,,,,,,,,,,,,,,,,,,,,,,,,,
,,,,,,,,,,,,,,,,,,,,,,,,,yes,,,,,,,,,,,,,,,,,,,,,,,,,2018-12-31,,,,,,,,,,,,,,1.60,,,,,,,,,,,,,,,,,,8,8,,,,A number of proposals and applications relate to site. Application for scheme of 8 dwellings permitted June 2017 - 17/01360/REM. This latest consent supersedes initial outline and reserved matters consents - 14/02721/OUT and 15/03842/REM,,,,,,local-authority-eng:NBL,,not owned by a public authority,,,,,,,,2016-01-29,https://publicaccess.northumberland.gov.uk/online-applications/propertyDetails.do?activeTab=relatedCases&keyVal=M5WU5RQS04P00,permissioned,reserved matters approval,,,,,,,,,,,,,,,,,,,,,,3651x,"""Mitford Water Treatment Works (brownfield parcel)""",http://northumberland.maps.arcgis.com/apps/webappviewer/index.html?id=c1b801d50f8040efbf8c9bc9f916cfae,,,2017-12-17,,,,,,,,,,,,,,,,,,,,,,,,,,
,,,,,,,,,,,,,,,,,,,,,,,,,,,,,,,,,,,,,,,,,,,,,,,,,,2017-12-17,,,,,,,,,,,,,,0.10,,,,,,,,,,,,,,,,,,7,7,,,,No relevant planning history,,,,,,local-authority-eng:NBL,,,,,,,,,,,,not permissioned,,,,,,,,,,,,,,,,,,,,,,,4564x,"""High House Farm, Front Street, Bebside (brownfield parcel)""",http://northumberland.maps.arcgis.com/apps/webappviewer/index.html?id=c1b801d50f8040efbf8c9bc9f916cfae,,,2017-12-17,,,,,,,,,,,,,,,,,,,,,,,,,,
,,,,,,,,,,,,,,,,,,,,,,,,,yes,,,,,,,,,,,,,,,,,,,,,,,,,2018-12-31,,,,,,,,,,,,,,13.80,,,,,,,,,,,,,,,,,,257,257,,,,"Application for 'phase 1' of development of 145 two-, three- and four-bed semi and detached dwellings permitted October 2017 - 16/04622/FUL. This follows a reserved matters application for overall site involving remediation of former colliery land followed by construction of 257 dwellings - 12/03370/REM. Further the latter overall consent has been implemented",,,,,,local-authority-eng:NBL,,not owned by a public authority,,,,,,,,2013-02-01,https://publicaccess.northumberland.gov.uk/online-applications/propertyDetails.do?activeTab=relatedCases&keyVal=MDJ9Z5QS04P00,permissioned,full planning permission,,,,,,,,,,,,,,,,,,,,,,4573,"""Former Bates Colliery Site (Phase/Area 1), Blyth""",http://northumberland.maps.arcgis.com/apps/webappviewer/index.html?id=c1b801d50f8040efbf8c9bc9f916cfae,,,2016-06-30,,,,,,,,,,,,,,,,,,,,,,,,,,
,,,,,,,,,,,,,,,,,,,,,,,,,,,,,,,,,,,,,,,,,,,,,,,,,,2017-12-17,,,,,,,,,,,,,,0.18,,,,,,,,,,,,,,,,,,6,6,,,,"Application has lapsed for demolition and replacement with 6 unit apartment block and 3 cottages, initially refused but allowed on appeal - B/07/00598/FUL",,,,,,local-authority-eng:NBL,,not owned by a public authority,,,,,,,,2008-04-02,https://publicaccess.northumberland.gov.uk/online-applications/propertyDetails.do?activeTab=relatedCases&keyVal=KRLX15LW00A00,not permissioned,,,,,,,,,,,,,,,,,,,,,,,4655,"""Westfield, Church Street, Cramlington""",http://northumberland.maps.arcgis.com/apps/webappviewer/index.html?id=c1b801d50f8040efbf8c9bc9f916cfae,,,2016-06-30,,,,,,,,,,,,,,,,,,,,,,,,,,
,,,,,,,,,,,,,,,,,,,,,,,,,yes,,,,,,,,,,,,,,,,,,,,,,,,,2018-12-31,,,,,,,,,,,,,,0.45,,,,,,,,,,,,,,,,,,43,43,,,,"Previous permission now lapsed for scheme of 48 dwellings on part of site, comprising comprising 33 flats, 9 terraced houses, 4 detached houses and 2 bungalows - 10/S/00290/VARYCO. This extended the time limit of original application - 06/00225/FUL.",,,,,,local-authority-eng:NBL,,not owned by a public authority,,,,,,,,,https://publicaccess.northumberland.gov.uk/online-applications/propertyDetails.do?activeTab=relatedCases&keyVal=L5YDNIQS04N00,not permissioned,,,,,,,,,,,,,,,,,,,,,,,4663,"""Land around and including Malvins House Close, Blyth""",http://northumberland.maps.arcgis.com/apps/webappviewer/index.html?id=c1b801d50f8040efbf8c9bc9f916cfae,,,2016-06-30,,,,,,,,,,,,,,,,,,,,,,,,,,
,,,,,,,,,,,,,,,,,,,,,,,,,,,,,,,,,,,,,,,,,,,,,,,,,,2017-12-17,,,,,,,,,,,,,,0.51,,,,,,,,,,,,,,,,,,14,14,,,,"Application submitted for mixed-use development, including 15 new build dwellings and a pub/hotel, but lapsed without progress - 09/S/00330/OUT",,,,,,local-authority-eng:NBL,,not owned by a public authority,,,,,,,,2010-03-14,https://publicaccess.northumberland.gov.uk/online-applications/propertyDetails.do?activeTab=relatedCases&keyVal=005V3VTGLI000,not permissioned,,,,,,,,,,,,,,,,,,,,,,,4669x,"""Link House Buildings and Land, Links Road, Blyth (brownfield parcel)""",http://northumberland.maps.arcgis.com/apps/webappviewer/index.html?id=c1b801d50f8040efbf8c9bc9f916cfae,,,2017-12-17,,,,,,,,,,,,,,,,,,,,,,,,,,
,,,,,,,,,,,,,,,,,,,,,,,,,,,,,,,,,,,,,,,,,,,,,,,,,,2017-12-17,,,,,,,,,,,,,,0.57,,,,,,,,,,,,,,,,,,12,12,,,,Change of use of former fire station to office to storage/distribution approved - 15/00205/COU,,,,,,local-authority-eng:NBL,,,,,,,,,,,https://publicaccess.northumberland.gov.uk/online-applications/propertyDetails.do?activeTab=relatedCases&keyVal=OD6I2LQS0CE02,not permissioned,,,,,,,,,,,,,,,,,,,,,,,4713,"""Cramlington Fire Station""",http://northumberland.maps.arcgis.com/apps/webappviewer/index.html?id=c1b801d50f8040efbf8c9bc9f916cfae,,,2016-06-30,,,,,,,,,,,,,,,,,,,,,,,,,,
,,,,,,,,,,,,,,,,,,,,,,,,,yes,,,,,,,,,,,,,,,,,,,,,,,,,2017-12-17,,,,,,,,,,,,,,2.11,,,,,,,,,,,,,,,,,,49,49,,,,Planning consent in place for scheme of 49 two- three- and four-bed dwellings - 15/01941/FUL,,,,,,local-authority-eng:NBL,,,,,,,,,,2016-03-31,https://publicaccess.northumberland.gov.uk/online-applications/propertyDetails.do?activeTab=relatedCases&keyVal=NBL2PIQS0CE00,permissioned,full planning permission,,,,,,,,,,,,,,,,,,,,,,4736,"""Commissioners Quay, Quay Road, Blyth""",http://northumberland.maps.arcgis.com/apps/webappviewer/index.html?id=c1b801d50f8040efbf8c9bc9f916cfae,,,2016-06-30,,,,,,,,,,,,,,,,,,,,,,,,,,
,,,,,,,,,,,,,,,,,,,,,,,,,,,,,,,,,,,,,,,,,,,,,,,,,,2017-12-17,,,,,,,,,,,,,,0.08,,,,,,,,,,,,,,,,,,5,5,,,,"Proposal for development of 5 units permitted, including 3 two-bed apartments and a one-bedroom apartment at second floor level, with a three-bed townhouse  -16/00880/FUL. Previous permission lapsed before commencement - 11/01565/FUL",,,,,,local-authority-eng:NBL,,not owned by a public authority,,,,,,,,2011-10-31,https://publicaccess.northumberland.gov.uk/online-applications/propertyDetails.do?activeTab=relatedCases&keyVal=005RVCTGLI000,permissioned,full planning permission,,,,,,,,,,,,,,,,,,,,,,4754,"""13 Allensgreen, Church Street, Cramlington""",http://northumberland.maps.arcgis.com/apps/webappviewer/index.html?id=c1b801d50f8040efbf8c9bc9f916cfae,,,2016-06-30,,,,,,,,,,,,,,,,,,,,,,,,,,
,,,,,,,,,,,,,,,,,,,,,,,,,,,,,,,,,,,,,,,,,,,,,,,,,,2017-12-17,,,,,,,,,,,,,,0.76,,,,,,,,,,,,,,,,,,7,7,,,,Previous outline planning permission for up to 24 units lapsed without implementation - 07/00533/OUT,,,,,,local-authority-eng:NBL,,not owned by a public authority,,,,,,,,2007-12-04,https://publicaccess.northumberland.gov.uk/online-applications/propertyDetails.do?activeTab=relatedCases&keyVal=KRRIJSLW00A00,not permissioned,,,,,,,,,,,,,,,,,,,,,,,4757,"""East Cramlington Farm House, The Paddock, Cramlington""",http://northumberland.maps.arcgis.com/apps/webappviewer/index.html?id=c1b801d50f8040efbf8c9bc9f916cfae,,,2017-12-17,,,,,,,,,,,,,,,,,,,,,,,,,,
,,,,,,,,,,,,,,,,,,,,,,,,,,,,,,,,,,,,,,,,,,,,,,,,,,2017-12-17,,,,,,,,,,,,,,0.06,,,,,,,,,,,,,,,,,,5,5,,,,Consent secured for 6 maisonettes (1.5 storey) above retail unit but scheme has not been progressed and has now lapsed - 07/00539/FUL,,,,,,local-authority-eng:NBL,,not owned by a public authority,,,,,,,,2007-12-04,https://publicaccess.northumberland.gov.uk/online-applications/advancedSearchResults.do?action=firstPage,not permissioned,,,,,,,,,,,,,,,,,,,,,,,4772,"""Units 21E-21G Briardale Road & 29-33 Cowpen Hall Road, Blyth""",http://northumberland.maps.arcgis.com/apps/webappviewer/index.html?id=c1b801d50f8040efbf8c9bc9f916cfae,,,2016-06-30,,,,,,,,,,,,,,,,,,,,,,,,,,
,,,,,,,,,,,,,,,,,,,,,,,,,,,,,,,,,,,,,,,,,,,,,,,,,,2017-12-17,,,,,,,,,,,,,,0.26,,,,,,,,,,,,,,,,,,14,14,,,,"Outline consent for 15 dwellings previously secured but lapsed without progress - 07/00601/OUT. A umber of other applications relate to existing uses - 14/04264/COU, 16/03225/FUL",,,,,,local-authority-eng:NBL,,,,,,,,,,2008-02-05,https://publicaccess.northumberland.gov.uk/online-applications/applicationDetails.do?activeTab=summary&keyVal=JSGWU7DC03L00,not permissioned,,,,,,,,,,,,,,,,,,,,,,,4791,"""Land at Bebside Motors, Front Street, Bebside""",http://northumberland.maps.arcgis.com/apps/webappviewer/index.html?id=c1b801d50f8040efbf8c9bc9f916cfae,,,2016-06-30,,,,,,,,,,,,,,,,,,,,,,,,,,
,,,,,,,,,,,,,,,,,,,,,,,,,,,,,,,,,,,,,,,,,,,,,,,,,,2017-12-17,,,,,,,,,,,,,,0.03,,,,,,,,,,,,,,,,,,5,5,,,,"Approval for mixed-use scheme, including provision of 6 flats above ground floor retail/commercial units, lapsed without implementation - B/08/00054/FUL. Extension of time limit refused - 11/00064/VARYCO. 
Previous proposal refused, with appeal dismissed - APP/P2935/A/12/2189282",,,,,,local-authority-eng:NBL,,,,,,,,,,2008-04-01,https://publicaccess.northumberland.gov.uk/online-applications/propertyDetails.do?activeTab=relatedCases&keyVal=L1WEOWQS04O00,not permissioned,,,,,,,,,,,,,,,,,,,,,,,4796,"""Second Hand Shop, King Street, Blyth""",http://northumberland.maps.arcgis.com/apps/webappviewer/index.html?id=c1b801d50f8040efbf8c9bc9f916cfae,,,2017-12-17,,,,,,,,,,,,,,,,,,,,,,,,,,
,,,,,,,,,,,,,,,,,,,,,,,,,yes,,,,,,,,,,,,,,,,,,,,,,,,,2018-12-31,,,,,,,,,,,,,,0.34,,,,,,,,,,,,,,,,,,14,14,,,,Application for 14 bungalows for affordable rent permitted June 2017 - 16/04102/FUL. Previous application was withdrawn - 10/S/00163/FUL,,,,,,local-authority-eng:NBL,,owned by a public authority,,,,,,,,2017-06-23,https://publicaccess.northumberland.gov.uk/online-applications/propertyDetails.do?activeTab=relatedCases&keyVal=OCCVJRQS0GA01,permissioned,full planning permission,,,,,,,,,,,,,,,,,,,,,,4812,"""Former Nursery site and Car Park adjoining Newsham First School, Wharton Street, Blyth""",http://northumberland.maps.arcgis.com/apps/webappviewer/index.html?id=c1b801d50f8040efbf8c9bc9f916cfae,,,2016-06-30,,,,,,,,,,,,,,,,,,,,,,,,,,
,,,,,,,,,,,,,,,,,,,,,,,,,,,,,,,,,,,,,,,,,,,,,,,,,,2017-12-17,,,,,,,,,,,,,,0.30,,,,,,,,,,,,,,,,,,11,11,,,,No relevant planning history,,,,,,local-authority-eng:NBL,,not owned by a public authority,,,,,,,,,,not permissioned,,,,,,,,,,,,,,,,,,,,,,,5020,"""Essendene, Kenilworth Road, Ashington""",http://northumberland.maps.arcgis.com/apps/webappviewer/index.html?id=c1b801d50f8040efbf8c9bc9f916cfae,,,2016-06-30,,,,,,,,,,,,,,,,,,,,,,,,,,
,,,,,,,,,,,,,,,,,,,,,,,,,,,,,,,,,,,,,,,,,,,,,,,,,,2017-12-17,,,,,,,,,,,,,,0.28,,,,,,,,,,,,,,,,,,5,5,,,,Previous permission now lapsed for conversion of mansard-type roofspace to 6 flats - 11/01075/FUL. Resubmission following initial refused application - 10/S/00393/FUL,,,,,,local-authority-eng:NBL,,not owned by a public authority,,,,,,,,2012-07-13,https://publicaccess.northumberland.gov.uk/online-applications/propertyDetails.do?activeTab=relatedCases&keyVal=00IWKYTGLI000,not permissioned,,,,,,,,,,,,,,,,,,,,,,,5021,"""Pembroke Court, Woodlea, Newbiggin-by-the-Sea""",http://northumberland.maps.arcgis.com/apps/webappviewer/index.html?id=c1b801d50f8040efbf8c9bc9f916cfae,,,2016-06-30,,,,,,,,,,,,,,,,,,,,,,,,,,
,,,,,,,,,,,,,,,,,,,,,,,,,,,,,,,,,,,,,,,,,,,,,,,,,,2017-12-17,,,,,,,,,,,,,,0.09,,,,,,,,,,,,,,,,,,11,11,,,,Planning consent for demolition of petrol station and redevelopment of site for 12 apartments but  has lapsed without commencement - 10/S/00536/VARYCO. This extended the original outline application - 06/00393/OUT,,,,,,local-authority-eng:NBL,,not owned by a public authority,,,,,,,,2011-07-26,https://publicaccess.northumberland.gov.uk/online-applications/propertyDetails.do?activeTab=relatedCases&keyVal=NMSK8XQS0CE00,not permissioned,,,,,,,,,,,,,,,,,,,,,,,5028,"""West End Service Station, North Seaton Road, Newbiggin-by-the-Sea""",http://northumberland.maps.arcgis.com/apps/webappviewer/index.html?id=c1b801d50f8040efbf8c9bc9f916cfae,,,2016-06-30,,,,,,,,,,,,,,,,,,,,,,,,,,
,,,,,,,,,,,,,,,,,,,,,,,,,,,,,,,,,,,,,,,,,,,,,,,,,,2017-12-17,,,,,,,,,,,,,,0.07,,,,,,,,,,,,,,,,,,9,9,,,,Permission lapsed without implementation for scheme of 10 apartments - 07/00250/FUL. A subsequent application to extend time limit was withdrawn - 10/S/00570/VARYCO,,,,,,local-authority-eng:NBL,,,,,,,,,,2008-02-13,https://publicaccess.northumberland.gov.uk/online-applications/propertyDetails.do?activeTab=relatedCases&keyVal=00ITU8TGLI000,not permissioned,,,,,,,,,,,,,,,,,,,,,,,5035,"""23 Station Road, Bedlington""",http://northumberland.maps.arcgis.com/apps/webappviewer/index.html?id=c1b801d50f8040efbf8c9bc9f916cfae,,,2016-06-30,,,,,,,,,,,,,,,,,,,,,,,,,,
,,,,,,,,,,,,,,,,,,,,,,,,,,,,,,,,,,,,,,,,,,,,,,,,,,2017-12-17,,,,,,,,,,,,,,0.05,,,,,,,,,,,,,,,,,,9,9,,,,Proposal for 8 flats and 2 houses granted consent but application has now lapsed - 08/00113/FUL,,,,,,local-authority-eng:NBL,,,,,,,,,,2008-06-26,https://publicaccess.northumberland.gov.uk/online-applications/propertyDetails.do?activeTab=relatedCases&keyVal=00J00PTGLI000,not permissioned,,,,,,,,,,,,,,,,,,,,,,,5037,"""Land to the rear 91 North Seaton Road, Ashington""",http://northumberland.maps.arcgis.com/apps/webappviewer/index.html?id=c1b801d50f8040efbf8c9bc9f916cfae,,,2016-06-30,,,,,,,,,,,,,,,,,,,,,,,,,,
,,,,,,,,,,,,,,,,,,,,,,,,,,,,,,,,,,,,,,,,,,,,,,,,,,2018-12-31,,,,,,,,,,,,,,0.61,,,,,,,,,,,,,,,,,,14,14,,,,Draft Local Plan housing allocation. Planning application for development of 66 homes following demolition of school currently pending consideration - 16/03954/FUL,,,,,,local-authority-eng:NBL,,owned by a public authority,,,,,,,,,https://publicaccess.northumberland.gov.uk/online-applications/propertyDetails.do?activeTab=relatedCases&keyVal=KTMGGZLW00A00,pending decision,,,,,,,,,,,,,,,,,,,,,,,5059x,"""Moorside First School, Woodhorn Road, Newbiggin-by-the-Sea (brownfield parcel)""",http://northumberland.maps.arcgis.com/apps/webappviewer/index.html?id=c1b801d50f8040efbf8c9bc9f916cfae,,,2017-12-17,,,,,,,,,,,,,,,,,,,,,,,,,,
,,,,,,,,,,,,,,,,,,,,,,,,,,,,,,,,,,,,,,,,,,,,,,,,,,2017-12-17,,,,,,,,,,,,,,0.41,,,,,,,,,,,,,,,,,,10,10,,,,Application for change of use to include mixed use development approved July 2017 - 17/01879/FUL,,,,,,local-authority-eng:NBL,,,,,,,,,,,https://publicaccess.northumberland.gov.uk/online-applications/propertyDetails.do?activeTab=relatedCases&keyVal=KUHP5UQS04O00,not permissioned,,,,,,,,,,,,,,,,,,,,,,,5060,"""Ashington Fire Station, Morpeth Road, Ashington""",http://northumberland.maps.arcgis.com/apps/webappviewer/index.html?id=c1b801d50f8040efbf8c9bc9f916cfae,,,2016-06-30,,,,,,,,,,,,,,,,,,,,,,,,,,
,,,,,,,,,,,,,,,,,,,,,,,,,,,,,,,,,,,,,,,,,,,,,,,,,,2017-12-17,,,,,,,,,,,,,,0.45,,,,,,,,,,,,,,,,,,14,14,,,,"Reserved matters consent approved for demolition, remediation and redevelopment of 14 homes - 11/02989/REM. Initial outline consent - 07/00557/OUT. Planning permission has been implemented through site works",,,,,,local-authority-eng:NBL,,not owned by a public authority,,,,,,,,2012-03-23,https://publicaccess.northumberland.gov.uk/online-applications/propertyDetails.do?activeTab=relatedCases&keyVal=00IC2CTGLI000,permissioned,reserved matters approval,,,,,,,,,,,,,,,,,,,,,,5066,"""Bungalow and New Dolphin Garage, Front Street, Newbiggin-by-the-Sea""",http://northumberland.maps.arcgis.com/apps/webappviewer/index.html?id=c1b801d50f8040efbf8c9bc9f916cfae,,,2016-06-30,,,,,,,,,,,,,,,,,,,,,,,,,,
,,,,,,,,,,,,,,,,,,,,,,,,,yes,,,,,,,,,,,,,,,,,,,,,,,,,2018-12-31,,,,,,,,,,,,,,0.60,,,,,,,,,,,,,,,,,,21,21,,,,"Outline permission for extensive mixed-use development on part of site, focus on retail, employment and leisure uses and also including 12 dwellings - 17/00444/OUT",,,,,,local-authority-eng:NBL,,,,,,,,,,2017-07-11,https://publicaccess.northumberland.gov.uk/online-applications/propertyDetails.do?activeTab=relatedCases&keyVal=00IU7DTGLI000,permissioned,outline planning permission,,,,,,,,,,,,,,,,,,,,,,5079,"""Land to North of Market Place, Bedlington""",http://northumberland.maps.arcgis.com/apps/webappviewer/index.html?id=c1b801d50f8040efbf8c9bc9f916cfae,,,2017-12-17,,,,,,,,,,,,,,,,,,,,,,,,,,
,,,,,,,,,,,,,,,,,,,,,,,,,,,,,,,,,,,,,,,,,,,,,,,,,,2017-12-17,,,,,,,,,,,,,,2.64,,,,,,,,,,,,,,,,,,27,27,,,,No relevant planning history,,,,,,local-authority-eng:NBL,,,,,,,,,,,,not permissioned,,,,,,,,,,,,,,,,,,,,,,,5083,"""Land adjacent to Cambois First School""",http://northumberland.maps.arcgis.com/apps/webappviewer/index.html?id=c1b801d50f8040efbf8c9bc9f916cfae,,,2017-12-17,,,,,,,,,,,,,,,,,,,,,,,,,,
,,,,,,,,,,,,,,,,,,,,,,,,,,,,,,,,,,,,,,,,,,,,,,,,,,2017-12-17,,,,,,,,,,,,,,3.23,,,,,,,,,,,,,,,,,,87,87,,,,No relevant planning history,,,,,,local-authority-eng:NBL,,not owned by a public authority,,,,,,,,,,not permissioned,,,,,,,,,,,,,,,,,,,,,,,5094,"""Welwyn Electronics Park Site A, Bedlington""",http://northumberland.maps.arcgis.com/apps/webappviewer/index.html?id=c1b801d50f8040efbf8c9bc9f916cfae,,,2016-06-30,,,,,,,,,,,,,,,,,,,,,,,,,,
,,,,,,,,,,,,,,,,,,,,,,,,,,,,,,,,,,,,,,,,,,,,,,,,,,2018-12-31,,,,,,,,,,,,,,7.61,,,,,,,,,,,,,,,,,,162,162,,,,"Previous outline application for comprehensive mixed-use redevelopment of wider site withdrawn, included site remediation and construction of 323 houses, along with retail, health facilities and infrastructure  - 08/00403/OUTES. This revised original proposal for 467 homes and supporting uses",,,,,,local-authority-eng:NBL,,,,,,,,,,,https://publicaccess.northumberland.gov.uk/online-applications/propertyDetails.do?activeTab=relatedCases&keyVal=00J2B4TGLI000,not permissioned,,,,,,,,,,,,,,,,,,,,,,,5098,"""Vald Birn UK Ltd, Cambois""",http://northumberland.maps.arcgis.com/apps/webappviewer/index.html?id=c1b801d50f8040efbf8c9bc9f916cfae,,,2017-12-17,,,,,,,,,,,,,,,,,,,,,,,,,,
,,,,,,,,,,,,,,,,,,,,,,,,,,,,,,,,,,,,,,,,,,,,,,,,,,2017-12-17,,,,,,,,,,,,,,0.16,,,,,,,,,,,,,,,,,,5,5,,,,No relevant planning history,,,,,,local-authority-eng:NBL,,,,,,,,,,,,not permissioned,,,,,,,,,,,,,,,,,,,,,,,5116x,"""Woodhorn Road, Newbiggin-by-the-Sea (brownfield parcel)""",http://northumberland.maps.arcgis.com/apps/webappviewer/index.html?id=c1b801d50f8040efbf8c9bc9f916cfae,,,2017-12-17,,,,,,,,,,,,,,,,,,,,,,,,,,
,,,,,,,,,,,,,,,,,,,,,,,,,,,,,,,,,,,,,,,,,,,,,,,,,,2017-12-17,,,,,,,,,,,,,,0.26,,,,,,,,,,,,,,,,,,5,5,,,,No relevant planning history,,,,,,local-authority-eng:NBL,,,,,,,,,,,,not permissioned,,,,,,,,,,,,,,,,,,,,,,,5121,"""Land at Debdon House, Cambois""",http://northumberland.maps.arcgis.com/apps/webappviewer/index.html?id=c1b801d50f8040efbf8c9bc9f916cfae,,,2017-12-17,,,,,,,,,,,,,,,,,,,,,,,,,,
,,,,,,,,,,,,,,,,,,,,,,,,,,,,,,,,,,,,,,,,,,,,,,,,,,2017-12-17,,,,,,,,,,,,,,0.74,,,,,,,,,,,,,,,,,,23,23,,,,No relevant planning history,,,,,,local-authority-eng:NBL,,owned by a public authority,,,,,,,,,,not permissioned,,,,,,,,,,,,,,,,,,,,,,,5133,"""Coulson Park First School, Alexandra Road, Ashington""",http://northumberland.maps.arcgis.com/apps/webappviewer/index.html?id=c1b801d50f8040efbf8c9bc9f916cfae,,,2016-06-30,,,,,,,,,,,,,,,,,,,,,,,,,,
,,,,,,,,,,,,,,,,,,,,,,,,,,,,,,,,,,,,,,,,,,,,,,,,,,2018-12-31,,,,,,,,,,,,,,0.17,,,,,,,,,,,,,,,,,,5,5,,,,Outline permission granted for 6 three-bed dwellings following demolition but not commenced and has lapsed - 12/03080/OUT. Previous application for 6 units withdrawn - 12/00219/OUT,,,,,,local-authority-eng:NBL,,not owned by a public authority,,,,,,,,,https://publicaccess.northumberland.gov.uk/online-applications/propertyDetails.do?activeTab=relatedCases&keyVal=00ITXWTGLI000,not permissioned,,,,,,,,,,,,,,,,,,,,,,,5135,"""Bernicea, Cambois""",http://northumberland.maps.arcgis.com/apps/webappviewer/index.html?id=c1b801d50f8040efbf8c9bc9f916cfae,,,2017-12-17,,,,,,,,,,,,,,,,,,,,,,,,,,
,,,,,,,,,,,,,,,,,,,,,,,,,yes,,,,,,,,,,,,,,,,,,,,,,,,,2017-12-17,,,,,,,,,,,,,,0.14,,,,,,,,,,,,,,,,,,19,19,,,,"A number of proposals relate to site. Application allowed on appeal for residential development of 19 flats, technically implemented and will not lapse - 03/00442/FUL. Application for change of use from church hall to 3 dwellings refused - 08/00133/FUL. Further scheme for demolition and erection of 12 units also refused - 09/00003/FUL. Previous application allowed on appeal for residential development of 19 homes but lapsed without start - 03/00442/FUL",,,,,,local-authority-eng:NBL,,not owned by a public authority,,,,,,,,2014-02-01,https://publicaccess.northumberland.gov.uk/online-applications/propertyDetails.do?activeTab=relatedCases&keyVal=OP4JS1QS0CE02,permissioned,full planning permission,,,,,,,,,,,,,,,,,,,,,,5136,"""St Cuthbert's Church Hall, Front Street, Bedlington""",http://northumberland.maps.arcgis.com/apps/webappviewer/index.html?id=c1b801d50f8040efbf8c9bc9f916cfae,,,2016-06-30,,,,,,,,,,,,,,,,,,,,,,,,,,
,,,,,,,,,,,,,,,,,,,,,,,,,,,,,,,,,,,,,,,,,,,,,,,,,,2017-12-17,,,,,,,,,,,,,,0.44,,,,,,,,,,,,,,,,,,11,11,,,,No relevant planning history,,,,,,local-authority-eng:NBL,,not owned by a public authority,,,,,,,,,,not permissioned,,,,,,,,,,,,,,,,,,,,,,,5141,"""Site of Demolished Houses - Woodhorn Villas, Blyth Terrace, Ashington""",http://northumberland.maps.arcgis.com/apps/webappviewer/index.html?id=c1b801d50f8040efbf8c9bc9f916cfae,,,2016-06-30,,,,,,,,,,,,,,,,,,,,,,,,,,
,,,,,,,,,,,,,,,,,,,,,,,,,,,,,,,,,,,,,,,,,,,,,,,,,,2018-12-31,,,,,,,,,,,,,,5.56,,,,,,,,,,,,,,,,,,100,100,,,,"Saved Wansbeck District Local Plan employment land allocation, but proposed for deallocation in the draft Northumberland Local Plan.",,,,,,local-authority-eng:NBL,,not owned by a public authority,,,,,,,,,,not permissioned,,,,,,,,,,,,,,,,,,,,,,,5172,"""Welwyn Electronics Park Site B, Bedlington""",http://northumberland.maps.arcgis.com/apps/webappviewer/index.html?id=c1b801d50f8040efbf8c9bc9f916cfae,,,2016-06-30,,,,,,,,,,,,,,,,,,,,,,,,,,
