,,,,,,,,,,,,,,,,,,,,,,,,,,,,,,,,,,,,,,,,,,,,,,,,,,2017-12-17,,,,,,,,,,,,,,0.05,,,,,,,,,,,,,,,,,,5,5,,,,Consent previously granted for construction of 6 flats but this has now lapsed - 08/00326/FUL. Previous application refused - 08/00259/FUL,,,,,,local-authority-eng:NBL,,,,,,,,,,2008-10-22,https://publicaccess.northumberland.gov.uk/online-applications/propertyDetails.do?activeTab=relatedCases&keyVal=MJP7QVQS04P00,not permissioned,,,,,,,,,,,,,,,,,,,,,,,5176,"""Warehouse to the rear of Jubilee Terrace, Bedlington""",http://northumberland.maps.arcgis.com/apps/webappviewer/index.html?id=c1b801d50f8040efbf8c9bc9f916cfae,,,2017-12-17,,,,,,,,,,,,,,,,,,,,,,,,,,
,,,,,,,,,,,,,,,,,,,,,,,,,,,,,,,,,,,,,,,,,,,,,,,,,,2017-12-17,,,,,,,,,,,,,,0.07,,,,,,,,,,,,,,,,,,5,5,,,,"Outline permission for a wider site, for a scheme of 48 units with construction of 41 units following demolition, conversion of existing building to create 6 apartment and change of use of shop to create an apartment, was not progressed and has lapsed - 09/00040/OUT",,,,,,local-authority-eng:NBL,,,,,,,,,,2010-11-24,https://publicaccess.northumberland.gov.uk/online-applications/propertyDetails.do?activeTab=relatedCases&keyVal=00IRI5TGLI000,not permissioned,,,,,,,,,,,,,,,,,,,,,,,5179,"""126 Front Street, Newbiggin-by-the-Sea""",http://northumberland.maps.arcgis.com/apps/webappviewer/index.html?id=c1b801d50f8040efbf8c9bc9f916cfae,,,2017-12-17,,,,,,,,,,,,,,,,,,,,,,,,,,
,,,,,,,,,,,,,,,,,,,,,,,,,,,,,,,,,,,,,,,,,,,,,,,,,,2017-12-17,,,,,,,,,,,,,,0.08,,,,,,,,,,,,,,,,,,5,5,,,,Previous permission for 5 new homes (4 net) lapsed without implementation - 12/00966/FUL. Variation to above refused and appeal dismissed - 13/03180/VARYCO (APP/P2935/A/14/2218950). Also see further application -  15/02021/FUL,,,,,,local-authority-eng:NBL,,,,,,,,,,2012-06-11,https://publicaccess.northumberland.gov.uk/online-applications/propertyDetails.do?activeTab=relatedCases&keyVal=002UG1TGLI000,not permissioned,,,,,,,,,,,,,,,,,,,,,,,6039,"""11 Mill Strand, Berwick-upon-Tweed""",http://northumberland.maps.arcgis.com/apps/webappviewer/index.html?id=c1b801d50f8040efbf8c9bc9f916cfae,,,2016-06-30,,,,,,,,,,,,,,,,,,,,,,,,,,
,,,,,,,,,,,,,,,,,,,,,,,,,,,,,,,,,,,,,,,,,,,,,,,,,,2018-12-31,,,,,,,,,,,,,,0.26,,,,,,,,,,,,,,,,,,5,5,,,,Previous permission lapsed for construction of 5 four-bed detatched houses (2.5 storey) following site clearance - 14/00945/FUL. Earlier consent for 5 homes also lapsed without start - CM/20100728,,,,,,local-authority-eng:NBL,,,,,,,,,,,https://publicaccess.northumberland.gov.uk/online-applications/propertyDetails.do?activeTab=relatedCases&keyVal=00BC30TGLI000,not permissioned,,,,,,,,,,,,,,,,,,,,,,,6339,"""Burnside Garage, Grange Road, Stamfordham""",http://northumberland.maps.arcgis.com/apps/webappviewer/index.html?id=c1b801d50f8040efbf8c9bc9f916cfae,,,2016-06-30,,,,,,,,,,,,,,,,,,,,,,,,,,
,,,,,,,,,,,,,,,,,,,,,,,,,,,,,,,,,,,,,,,,,,,,,,,,,,2017-12-17,,,,,,,,,,,,,,0.02,,,,,,,,,,,,,,,,,,5,5,,,,Scheme for change of use to 1 three-bed and 4 two-bed dwellings consented but permission has now lapsed - 12/00255/FUL,,,,,,local-authority-eng:NBL,,,,,,,,,,2013-01-10,https://publicaccess.northumberland.gov.uk/online-applications/propertyDetails.do?activeTab=relatedCases&keyVal=00DRWSTGLI000,not permissioned,,,,,,,,,,,,,,,,,,,,,,,6577,"""5 Battle Hill, Hexham""",http://northumberland.maps.arcgis.com/apps/webappviewer/index.html?id=c1b801d50f8040efbf8c9bc9f916cfae,,,2016-06-30,,,,,,,,,,,,,,,,,,,,,,,,,,
,,,,,,,,,,,,,,,,,,,,,,,,,yes,,,,,,,,,,,,,,,,,,,,,,,,,2017-12-17,,,,,,,,,,,,,,0.21,,,,,,,,,,,,,,,,,,30,30,,,,"Application permitted for change of use, from office to residential, and extension to deliver 30 flats - 13/02074/FUL. Previous application for 31 units withdrawn - 12/02181/FUL",,,,,,local-authority-eng:NBL,,,,,,,,,,2013-12-23,https://publicaccess.northumberland.gov.uk/online-applications/propertyDetails.do?activeTab=relatedCases&keyVal=00BC5PTGLI000,permissioned,full planning permission,,,,,,,,,,,,,,,,,,,,,,6595,"""Belville House, Cheviot View, Ponteland""",http://northumberland.maps.arcgis.com/apps/webappviewer/index.html?id=c1b801d50f8040efbf8c9bc9f916cfae,,,2017-12-17,,,,,,,,,,,,,,,,,,,,,,,,,,
,,,,,,,,,,,,,,,,,,,,,,,,,,,,,,,,,,,,,,,,,,,,,,,,,,2017-12-17,,,,,,,,,,,,,,0.33,,,,,,,,,,,,,,,,,,8,8,,,,Previous application withdrawn relating to proposal for demolition and change of use to 9 residential units - 12/02700/FUL. Also see permitted scheme for a single dwelling through change of use from commercial on small part of site - 15/00835/COU,,,,,,local-authority-eng:NBL,,,,,,,,,,2013-03-01,https://publicaccess.northumberland.gov.uk/online-applications/propertyDetails.do?activeTab=relatedCases&keyVal=000DDATGLI000,not permissioned,,,,,,,,,,,,,,,,,,,,,,,6609,"""HM Revenue & Customs, Bondgate Hall, Alnwick""",http://northumberland.maps.arcgis.com/apps/webappviewer/index.html?id=c1b801d50f8040efbf8c9bc9f916cfae,,,2016-06-30,,,,,,,,,,,,,,,,,,,,,,,,,,
,,,,,,,,,,,,,,,,,,,,,,,,,,,,,,,,,,,,,,,,,,,,,,,,,,2017-12-17,,,,,,,,,,,,,,0.44,,,,,,,,,,,,,,,,,,11,11,,,,No relevant planning history,,,,,,local-authority-eng:NBL,,,,,,,,,,,,not permissioned,,,,,,,,,,,,,,,,,,,,,,,6682,"""Hastings Street, Percy Street, Cramlington""",http://northumberland.maps.arcgis.com/apps/webappviewer/index.html?id=c1b801d50f8040efbf8c9bc9f916cfae,,,2017-12-17,,,,,,,,,,,,,,,,,,,,,,,,,,
,,,,,,,,,,,,,,,,,,,,,,,,,,,,,,,,,,,,,,,,,,,,,,,,,,2018-12-31,,,,,,,,,,,,,,0.02,,,,,,,,,,,,,,,,,,5,5,,,,Approval for demolition redevelopment of site for 5 flats has now lapsed - 08/00185/FUL,,,,,,local-authority-eng:NBL,,,,,,,,,,,https://publicaccess.northumberland.gov.uk/online-applications/propertyDetails.do?activeTab=relatedCases&keyVal=KZU1YWQS04O00,not permissioned,,,,,,,,,,,,,,,,,,,,,,,6685,"""Boathouse Garage, Bridge Street, Blyth""",http://northumberland.maps.arcgis.com/apps/webappviewer/index.html?id=c1b801d50f8040efbf8c9bc9f916cfae,,,2016-06-30,,,,,,,,,,,,,,,,,,,,,,,,,,
,,,,,,,,,,,,,,,,,,,,,,,,,yes,,,,,,,,,,,,,,,,,,,,,,,,,2018-12-31,,,,,,,,,,,,,,0.02,,,,,,,,,,,,,,,,,,21,21,,,,Full planning permission for scheme of 23 flats now lapsed - B/09/00008/FUL.,,,,,,local-authority-eng:NBL,,,,,,,,,,,https://publicaccess.northumberland.gov.uk/online-applications/advancedSearchResults.do?action=firstPage,not permissioned,,,,,,,,,,,,,,,,,,,,,,,6686,"""Former Builders Yard and Office, Union Street, Blyth""",http://northumberland.maps.arcgis.com/apps/webappviewer/index.html?id=c1b801d50f8040efbf8c9bc9f916cfae,,,2016-06-30,,,,,,,,,,,,,,,,,,,,,,,,,,
,,,,,,,,,,,,,,,,,,,,,,,,,,,,,,,,,,,,,,,,,,,,,,,,,,2017-12-17,,,,,,,,,,,,,,2.20,,,,,,,,,,,,,,,,,,54,54,,,,Allocated housing site in Wansbeck Local Plan - identified for 92 homes,,,,,,local-authority-eng:NBL,,,,,,,,,,,,not permissioned,,,,,,,,,,,,,,,,,,,,,,,6737,"""Site of the former Hirst Welfare, Ashington""",http://northumberland.maps.arcgis.com/apps/webappviewer/index.html?id=c1b801d50f8040efbf8c9bc9f916cfae,,,2016-06-30,,,,,,,,,,,,,,,,,,,,,,,,,,
,,,,,,,,,,,,,,,,,,,,,,,,,yes,,,,,,,,,,,,,,,,,,,,,,,,,2017-12-17,,,,,,,,,,,,,,0.47,,,,,,,,,,,,,,,,,,16,16,,,,"Outline application for development of 63 dwellings and up to 16 chalets permitted - 16/00592/OUT. 	Previous outline application for the development of a static caravan/chalet park, together with supporting facilities approved in August 2012 - 10/S/00573/OUT",,,,,,local-authority-eng:NBL,,,,,,,,,,2016-12-08,https://publicaccess.northumberland.gov.uk/online-applications/propertyDetails.do?activeTab=relatedCases&keyVal=M95HSIQS04P00,permissioned,outline planning permission,,,,,,,,,,,,,,,,,,,,,,6779x,"""Links Quarry, Newbiggin-by-the-Sea (brownfield parcel)""",http://northumberland.maps.arcgis.com/apps/webappviewer/index.html?id=c1b801d50f8040efbf8c9bc9f916cfae,,,2017-12-17,,,,,,,,,,,,,,,,,,,,,,,,,,
,,,,,,,,,,,,,,,,,,,,,,,,,yes,,,,,,,,,,,,,,,,,,,,,,,,,2017-12-17,,,,,,,,,,,,,,0.75,,,,,,,,,,,,,,,,,,9,9,,,,Latest application for reserved matters relating to permitted scheme for 10 units pending - 17/03151/REM. Outline permission has been granted for development of 10 dwellings - 14/03221/OUT,,,,,,local-authority-eng:NBL,,,,,,,,,,2015-05-06,https://publicaccess.northumberland.gov.uk/online-applications/propertyDetails.do?activeTab=relatedCases&keyVal=00DA6ZTGLI000,permissioned,outline planning permission,,,,,,,,,,,,,,,,,,,,,,6813x,"""Former Miners Welfare, Mickley (brownfield parcel)""",http://northumberland.maps.arcgis.com/apps/webappviewer/index.html?id=c1b801d50f8040efbf8c9bc9f916cfae,,,2017-12-17,,,,,,,,,,,,,,,,,,,,,,,,,,
,,,,,,,,,,,,,,,,,,,,,,,,,yes,,,,,,,,,,,,,,,,,,,,,,,,,2017-12-17,,,,,,,,,,,,,,1.62,,,,,,,,,,,,,,,,,,45,45,,,,Outline planning permission granted for residential development of up to 50 units on part of site - 15/03750/OUT,,,,,,local-authority-eng:NBL,,,,,,,,,,2016-09-09,https://publicaccess.northumberland.gov.uk/online-applications/propertyDetails.do?activeTab=relatedCases&keyVal=NY416JQS0GA00,permissioned,outline planning permission,,,,,,,,,,,,,,,,,,,,,,6839x,"""Eltringham Works, Prudhoe (brownfield parcel)""",http://northumberland.maps.arcgis.com/apps/webappviewer/index.html?id=c1b801d50f8040efbf8c9bc9f916cfae,,,2017-12-17,,,,,,,,,,,,,,,,,,,,,,,,,,
,,,,,,,,,,,,,,,,,,,,,,,,,,,,,,,,,,,,,,,,,,,,,,,,,,2018-12-31,,,,,,,,,,,,,,0.45,,,,,,,,,,,,,,,,,,7,7,,,,"Full permission for residential development of 35 three-, four- and five-bed dwellings - 14/02140/FUL.",,,,,,local-authority-eng:NBL,,,,,,,,,,2018-02-12,https://publicaccess.northumberland.gov.uk/online-applications/propertyDetails.do?activeTab=relatedCases&keyVal=L2M0EHQS04N00,permissioned,full planning permission,,,,,,,,,,,,,,,,,,,,,,6841x,"""Ideal Caravans, Clifton (brownfield parcel)""",http://northumberland.maps.arcgis.com/apps/webappviewer/index.html?id=c1b801d50f8040efbf8c9bc9f916cfae,,,2017-12-17,,,,,,,,,,,,,,,,,,,,,,,,,,
,,,,,,,,,,,,,,,,,,,,,,,,,,,,,,,,,,,,,,,,,,,,,,,,,,2018-12-31,,,,,,,,,,,,,,0.41,,,,,,,,,,,,,,,,,,11,11,,,,"Previous application for demolition school building and replacement with of 24 two- and three-bed dwellings following demolition of school building refused 19 October 2018, relates to both brownfield and greenfield land - 17/03894/FUL",,,,,,local-authority-eng:NBL,,owned by a public authority,,,,,,,,,https://publicaccess.northumberland.gov.uk/online-applications/propertyDetails.do?activeTab=relatedCases&keyVal=M82NQ6QS04N00,not permissioned,,,,,,,,,,,,,,,,,,,,,,,6950x,"""Land at Cornhill First School, St Helen's Gardens, Cornhill-on-Tweed (brownfield parcel)""",http://northumberland.maps.arcgis.com/apps/webappviewer/index.html?id=c1b801d50f8040efbf8c9bc9f916cfae,,,2017-12-17,,,,,,,,,,,,,,,,,,,,,,,,,,
,,,,,,,,,,,,,,,,,,,,,,,,,,,,,,,,,,,,,,,,,,,,,,,,,,2017-12-17,,,,,,,,,,,,,,0.23,,,,,,,,,,,,,,,,,,6,6,,,,"Application permitted for change of use from residential to business use, resulting in loss of one dwelling - 14/00246/COU",,,,,,local-authority-eng:NBL,,,,,,,,,,,https://publicaccess.northumberland.gov.uk/online-applications/propertyDetails.do?activeTab=relatedCases&keyVal=00ASNFTGLI000,not permissioned,,,,,,,,,,,,,,,,,,,,,,,6954,"""Cookswell Garage, Dark Lane, Pegswood""",http://northumberland.maps.arcgis.com/apps/webappviewer/index.html?id=c1b801d50f8040efbf8c9bc9f916cfae,,,2016-06-30,,,,,,,,,,,,,,,,,,,,,,,,,,
,,,,,,,,,,,,,,,,,,,,,,,,,yes,,,,,,,,,,,,,,,,,,,,,,,,,2017-12-17,,,,,,,,,,,,,,0.17,,,,,,,,,,,,,,,,,,5,5,,,,Permitted scheme for demolition and development of a 2.5 storey development comprising of 5 apartments - 16/00275/FUL. A number of previous applications are also relevant. Approval for single dwelling - 13/02887/FUL. Previous proposal for scheme of 6 units refused - 15/02484/FUL,,,,,,local-authority-eng:NBL,,,,,,,,,,2016-06-29,https://publicaccess.northumberland.gov.uk/online-applications/propertyDetails.do?activeTab=relatedCases&keyVal=OMYOSPQS0CE02,permissioned,full planning permission,,,,,,,,,,,,,,,,,,,,,,6981,"""Greystoke Surgery, Howard Terrace, Morpeth""",http://northumberland.maps.arcgis.com/apps/webappviewer/index.html?id=c1b801d50f8040efbf8c9bc9f916cfae,,,2017-12-17,,,,,,,,,,,,,,,,,,,,,,,,,,
,,,,,,,,,,,,,,,,,,,,,,,,,,,,,,,,,,,,,,,,,,,,,,,,,,2018-12-31,,,,,,,,,,,,,,0.05,,,,,,,,,,,,,,,,,,8,8,,,,"Full application previously permitted for redevelopment for 9 homes, through refurbishment of first and second floor alongside retail development, was not progressed and has now lapsed - 11/03042/FUL. Also see retrospective application approved for change of use (A2 to A3/A4) - 16/01385/COU",,,,,,local-authority-eng:NBL,,,,,,,,,,,https://publicaccess.northumberland.gov.uk/online-applications/propertyDetails.do?activeTab=relatedCases&keyVal=005OZWTGLI000,not permissioned,,,,,,,,,,,,,,,,,,,,,,,6992,"""12-16 Bridge Street (evens) and 2-10 Union Street (evens), Blyth""",http://northumberland.maps.arcgis.com/apps/webappviewer/index.html?id=c1b801d50f8040efbf8c9bc9f916cfae,,,2017-12-17,,,,,,,,,,,,,,,,,,,,,,,,,,
,,,,,,,,,,,,,,,,,,,,,,,,,,,,,,,,,,,,,,,,,,,,,,,,,,2017-12-17,,,,,,,,,,,,,,0.40,,,,,,,,,,,,,,,,,,10,10,,,,No relevant planning history,,,,,,local-authority-eng:NBL,,,,,,,,,,,,not permissioned,,,,,,,,,,,,,,,,,,,,,,,8037,"""Errington Street, Bebside""",http://northumberland.maps.arcgis.com/apps/webappviewer/index.html?id=c1b801d50f8040efbf8c9bc9f916cfae,,,2016-06-30,,,,,,,,,,,,,,,,,,,,,,,,,,
,,,,,,,,,,,,,,,,,,,,,,,,,,,,,,,,,,,,,,,,,,,,,,,,,,2018-12-31,,,,,,,,,,,,,,2.65,,,,,,,,,,,,,,,,,,27,27,,,,Draft Local Plan housing allocation.,,,,,,local-authority-eng:NBL,,,,,,,,,,,,not permissioned,,,,,,,,,,,,,,,,,,,,,,,8068,"""Berwick Seaview Caravan Site, Billendean Road, Berwick-upon-Tweed""",http://northumberland.maps.arcgis.com/apps/webappviewer/index.html?id=c1b801d50f8040efbf8c9bc9f916cfae,,,2017-12-17,,,,,,,,,,,,,,,,,,,,,,,,,,
,,,,,,,,,,,,,,,,,,,,,,,,,,,,,,,,,,,,,,,,,,,,,,,,,,2017-12-17,,,,,,,,,,,,,,0.25,,,,,,,,,,,,,,,,,,14,14,,,,Conversion of existing building to 14 two-bed apartments approved but not progressed to date - 14/03065/FUL,,,,,,local-authority-eng:NBL,,,,,,,,,,2015-01-07,https://publicaccess.northumberland.gov.uk/online-applications/propertyDetails.do?activeTab=relatedCases&keyVal=00DSQFTGLI000,permissioned,full planning permission,,,,,,,,,,,,,,,,,,,,,,8069,"""Border Pine Building, Aesica Road, Haltwhistle""",http://northumberland.maps.arcgis.com/apps/webappviewer/index.html?id=c1b801d50f8040efbf8c9bc9f916cfae,,,2016-06-30,,,,,,,,,,,,,,,,,,,,,,,,,,
,,,,,,,,,,,,,,,,,,,,,,,,,,,,,,,,,,,,,,,,,,,,,,,,,,2018-12-31,,,,,,,,,,,,,,2.00,,,,,,,,,,,,,,,,,,41,41,,,,Outline permission lapsed for mixed-use site including 60-bed two-storey care home and 45 houses - 11/03407/OUT. Previous application permitted for care home facility - 03/B/0845,,,,,,local-authority-eng:NBL,,,,,,,,,,,https://publicaccess.northumberland.gov.uk/online-applications/propertyDetails.do?activeTab=relatedCases&keyVal=002YRJTGLI000,not permissioned,,,,,,,,,,,,,,,,,,,,,,,8074,"""Seton Hall, Berwick-upon-Tweed""",http://northumberland.maps.arcgis.com/apps/webappviewer/index.html?id=c1b801d50f8040efbf8c9bc9f916cfae,,,2016-06-30,,,,,,,,,,,,,,,,,,,,,,,,,,
,,,,,,,,,,,,,,,,,,,,,,,,,,,,,,,,,,,,,,,,,,,,,,,,,,2018-12-31,,,,,,,,,,,,,,0.06,,,,,,,,,,,,,,,,,,5,5,,,,Previous planning permission lapsed for revised scheme of 5 three-bed terraced houses - 14/00679/FUL. Earlier outline consent for apartment scheme lapsed unimplemented - B/06/00136/OUT,,,,,,local-authority-eng:NBL,,,,,,,,,,,https://publicaccess.northumberland.gov.uk/online-applications/propertyDetails.do?activeTab=relatedCases&keyVal=KX7X1PQS04O00,not permissioned,,,,,,,,,,,,,,,,,,,,,,,8076,"""Former Wilson and Young, Clarence Street, Seaton Sluice""",http://northumberland.maps.arcgis.com/apps/webappviewer/index.html?id=c1b801d50f8040efbf8c9bc9f916cfae,,,2016-06-30,,,,,,,,,,,,,,,,,,,,,,,,,,
,,,,,,,,,,,,,,,,,,,,,,,,,yes,,,,,,,,,,,,,,,,,,,,,,,,,2017-12-17,,,,,,,,,,,,,,0.59,,,,,,,,,,,,,,,,,,24,24,,,,Full application pending consideration (minded to grant) for development of 34 homes across a larger site area - 16/03693/FUL. Outline planning consent in place for the erection of up to 27 dwellings - 15/01760/OUT,,,,,,local-authority-eng:NBL,,,,,,,,,,2016-02-19,https://publicaccess.northumberland.gov.uk/online-applications/propertyDetails.do?activeTab=relatedCases&keyVal=LXJELCQS04P01,permissioned,outline planning permission,,,,,,,,,,,,,,,,,,,,,,9008,"""Stannington Nurseries Tea Room, Stannington Station""",http://northumberland.maps.arcgis.com/apps/webappviewer/index.html?id=c1b801d50f8040efbf8c9bc9f916cfae,,,2017-12-17,,,,,,,,,,,,,,,,,,,,,,,,,,
,,,,,,,,,,,,,,,,,,,,,,,,,yes,,,,,,,,,,,,,,,,,,,,,,,,,2017-12-17,,,,,,,,,,,,,,1.92,,,,,,,,,,,,,,,,,,5,5,,,,Full planning permission for 5 dwellings (3 net additions) through conversion and change of use - 15/02771/FUL. Permitted scheme is resubmission of earlier withdrawn proposal -15/00645/FUL,,,,,,local-authority-eng:NBL,,,,,,,,,,2015-10-14,https://publicaccess.northumberland.gov.uk/online-applications/propertyDetails.do?activeTab=relatedCases&keyVal=MS8SONQS0CE00,permissioned,full planning permission,,,,,,,,,,,,,,,,,,,,,,9012,"""Buildings Surrounding Lesbury House, Lesbury""",http://northumberland.maps.arcgis.com/apps/webappviewer/index.html?id=c1b801d50f8040efbf8c9bc9f916cfae,,,2017-12-17,,,,,,,,,,,,,,,,,,,,,,,,,,
,,,,,,,,,,,,,,,,,,,,,,,,,,,,,,,,,,,,,,,,,,,,,,,,,,2017-12-17,,,,,,,,,,,,,,0.04,,,,,,,,,,,,,,,,,,8,8,,,,Outline application for development of 9 residential flats permitted - 15/01774/OUT,,,,,,local-authority-eng:NBL,,,,,,,,,,2015-07-27,https://publicaccess.northumberland.gov.uk/online-applications/propertyDetails.do?activeTab=relatedCases&keyVal=005QEETGLI000,permissioned,outline planning permission,,,,,,,,,,,,,,,,,,,,,,9019,"""8 Sussex Street, Blyth""",http://northumberland.maps.arcgis.com/apps/webappviewer/index.html?id=c1b801d50f8040efbf8c9bc9f916cfae,,,2017-12-17,,,,,,,,,,,,,,,,,,,,,,,,,,
,,,,,,,,,,,,,,,,,,,,,,,,,yes,,,,,,,,,,,,,,,,,,,,,,,,,2018-12-31,,,,,,,,,,,,,,0.13,,,,,,,,,,,,,,,,,,7,7,,,,"Permitted scheme for 8 dwellings (7 net additions) through conversion of listed building and new-build, alongside supporting uses - 15/02603/FUL",,,,,,local-authority-eng:NBL,,not owned by a public authority,,,,,,,,2016-10-14,https://publicaccess.northumberland.gov.uk/online-applications/propertyDetails.do?activeTab=relatedCases&keyVal=0007JFTGLI000,permissioned,full planning permission,,,,,,,,,,,,,,,,,,,,,,9028,"""Narrowgate House, Narrowgate, Alnwick""",http://northumberland.maps.arcgis.com/apps/webappviewer/index.html?id=c1b801d50f8040efbf8c9bc9f916cfae,,,2017-12-17,,,,,,,,,,,,,,,,,,,,,,,,,,
,,,,,,,,,,,,,,,,,,,,,,,,,yes,,,,,,,,,,,,,,,,,,,,,,,,,2018-12-31,,,,,,,,,,,,,,0.48,,,,,,,,,,,,,,,,,,38,38,,,,Consent in place for demolition of existing buildings (including bedsits and dwellings) and replacement by new-build development providing 38 units (net loss of 5 units) for elderly persons apartments in a two/three storey block - 16/03281/FUL. See demolition aspect of proposal - 16/02439/FUL,,,,,,local-authority-eng:NBL,,not owned by a public authority,,,,,,,,2016-12-08,https://publicaccess.northumberland.gov.uk/online-applications/propertyDetails.do?activeTab=relatedCases&keyVal=MXJS7OQS0CE01,permissioned,full planning permission,,,,,,,,,,,,,,,,,,,,,,9030,"""St Cuthbert's Close and 22 and 24 Hencotes, Hexham""",http://northumberland.maps.arcgis.com/apps/webappviewer/index.html?id=c1b801d50f8040efbf8c9bc9f916cfae,,,2017-12-17,,,,,,,,,,,,,,,,,,,,,,,,,,
,,,,,,,,,,,,,,,,,,,,,,,,,yes,,,,,,,,,,,,,,,,,,,,,,,,,2018-12-31,,,,,,,,,,,,,,0.07,,,,,,,,,,,,,,,,,,6,6,,,,Scheme for redevelopment of site for 6 four-bed terraced houses following demolition now permitted - 16/02306/FUL,,,,,,local-authority-eng:NBL,,not owned by a public authority,,,,,,,,2016-10-20,https://publicaccess.northumberland.gov.uk/online-applications/propertyDetails.do?activeTab=relatedCases&keyVal=00DUX5TGLI000,permissioned,full planning permission,,,,,,,,,,,,,,,,,,,,,,9031,"""The Drill Hall, Swallwell Close, Prudhoe""",http://northumberland.maps.arcgis.com/apps/webappviewer/index.html?id=c1b801d50f8040efbf8c9bc9f916cfae,,,2017-12-17,,,,,,,,,,,,,,,,,,,,,,,,,,
,,,,,,,,,,,,,,,,,,,,,,,,,yes,,,,,,,,,,,,,,,,,,,,,,,,,2018-12-31,,,,,,,,,,,,,,0.45,,,,,,,,,,,,,,,,,,14,14,,,,Application permitted for scheme for proposed conversion of former care home into 14 residential apartments - 16/00503/FUL. Also see pending application for loft conversion to provide single apartment - 17/03717/FUL,,,,,,local-authority-eng:NBL,,not owned by a public authority,,,,,,,,2016-08-15,https://publicaccess.northumberland.gov.uk/online-applications/propertyDetails.do?activeTab=relatedCases&keyVal=00DRH1TGLI000,permissioned,full planning permission,,,,,,,,,,,,,,,,,,,,,,9032,"""Stanleyburn House Residential Home, Station Road, Wylam""",http://northumberland.maps.arcgis.com/apps/webappviewer/index.html?id=c1b801d50f8040efbf8c9bc9f916cfae,,,2017-12-17,,,,,,,,,,,,,,,,,,,,,,,,,,
,,,,,,,,,,,,,,,,,,,,,,,,,yes,,,,,,,,,,,,,,,,,,,,,,,,,2018-12-31,,,,,,,,,,,,,,2.53,,,,,,,,,,,,,,,,,,15,15,,,,Application approved for development of 15 homes following demolition of indoor riding arena and outbuildings - 15/02656/FUL,,,,,,local-authority-eng:NBL,,,,,,,,,,2016-12-15,https://publicaccess.northumberland.gov.uk/online-applications/propertyDetails.do?activeTab=relatedCases&keyVal=O0FGSEQS0GA00,permissioned,full planning permission,,,,,,,,,,,,,,,,,,,,,,9034,"""Land West Of Swarland Equestrian Centre, Swarland""",http://northumberland.maps.arcgis.com/apps/webappviewer/index.html?id=c1b801d50f8040efbf8c9bc9f916cfae,,,2017-12-17,,,,,,,,,,,,,,,,,,,,,,,,,,
,,,,,,,,,,,,,,,,,,,,,,,,,yes,,,,,,,,,,,,,,,,,,,,,,,,,2018-12-31,,,,,,,,,,,,,,0.36,,,,,,,,,,,,,,,,,,5,5,,,,"Planning consent granted for redevelopment of Seaton House Farm site, includes demolition, change-of-use, conversion and new-build, providing a total of 5 units (4 net), comprising providing a four-bed, a two-bed and 3 three-bed dwellings - 16/04530/FUL",,,,,,local-authority-eng:NBL,,not owned by a public authority,,,,,,,,2017-03-01,https://publicaccess.northumberland.gov.uk/online-applications/propertyDetails.do?activeTab=relatedCases&keyVal=0003WYTGLI000,permissioned,full planning permission,,,,,,,,,,,,,,,,,,,,,,9037,"""Seaton House""",http://northumberland.maps.arcgis.com/apps/webappviewer/index.html?id=c1b801d50f8040efbf8c9bc9f916cfae,,,2017-12-17,,,,,,,,,,,,,,,,,,,,,,,,,,
,,,,,,,,,,,,,,,,,,,,,,,,,,,,,,,,,,,,,,,,,,,,,,,,,,2018-12-31,,,,,,,,,,,,,,0.36,,,,,,,,,,,,,,,,,,11,11,,,,Scheme for development of 11 homes on site of former school permitted - 16/00657/FUL,,,,,,local-authority-eng:NBL,,not owned by a public authority,,,,,,,,2016-09-09,https://publicaccess.northumberland.gov.uk/online-applications/propertyDetails.do?activeTab=relatedCases&keyVal=005QK8TGLI000,permissioned,full planning permission,,,,,,,,,,,,,,,,,,,,,,9040,"""Former Seaton Delaval County First School, Double Row, Seaton Delaval""",http://northumberland.maps.arcgis.com/apps/webappviewer/index.html?id=c1b801d50f8040efbf8c9bc9f916cfae,,,2017-12-17,,,,,,,,,,,,,,,,,,,,,,,,,,
,,,,,,,,,,,,,,,,,,,,,,,,,yes,,,,,,,,,,,,,,,,,,,,,,,,,2018-12-31,,,,,,,,,,,,,,0.55,,,,,,,,,,,,,,,,,,18,18,,,,"Full application for mixed-use development, including 12 townhouses and 6 apartments and commercial/industrial uses, permitted - 14/04259/FUL",,,,,,local-authority-eng:NBL,,,,,,,,,,2017-05-16,https://publicaccess.northumberland.gov.uk/online-applications/propertyDetails.do?activeTab=relatedCases&keyVal=00DSRNTGLI000,permissioned,full planning permission,,,,,,,,,,,,,,,,,,,,,,9041,"""Jools Laundry, Tinklers Bank, East of Corbridge Station""",http://northumberland.maps.arcgis.com/apps/webappviewer/index.html?id=c1b801d50f8040efbf8c9bc9f916cfae,,,2017-12-17,,,,,,,,,,,,,,,,,,,,,,,,,,
,,,,,,,,,,,,,,,,,,,,,,,,,yes,,,,,,,,,,,,,,,,,,,,,,,,,2018-12-31,,,,,,,,,,,,,,0.40,,,,,,,,,,,,,,,,,,5,5,,,,Outline application  for development of 6 homes permitted in May 2017 - 16/02482/OUT,,,,,,local-authority-eng:NBL,,not owned by a public authority,,,,,,,,2017-05-25,https://publicaccess.northumberland.gov.uk/online-applications/propertyDetails.do?activeTab=relatedCases&keyVal=00AUJETGLI000,permissioned,outline planning permission,,,,,,,,,,,,,,,,,,,,,,9042,"""Heddon Mill Farm""",http://northumberland.maps.arcgis.com/apps/webappviewer/index.html?id=c1b801d50f8040efbf8c9bc9f916cfae,,,2017-12-17,,,,,,,,,,,,,,,,,,,,,,,,,,
,,,,,,,,,,,,,,,,,,,,,,,,,,,,,,,,,,,,,,,,,,,,,,,,,,2018-12-31,,,,,,,,,,,,,,0.03,,,,,,,,,,,,,,,,,,6,6,,,,Full application for development of 4 two-bed flats and 2 two-bed maisonettes permitted November 2017 - 17/03099/FUL. Previous application for 7 dwellings withdrawn - 16/03591/FUL,,,,,,local-authority-eng:NBL,,,,,,,,,,2017-11-17,https://publicaccess.northumberland.gov.uk/online-applications/propertyDetails.do?activeTab=relatedCases&keyVal=005RENTGLI000,permissioned,full planning permission,,,,,,,,,,,,,,,,,,,,,,9050,"""The Bungalow, Cramlington""",http://northumberland.maps.arcgis.com/apps/webappviewer/index.html?id=c1b801d50f8040efbf8c9bc9f916cfae,,,2017-12-17,,,,,,,,,,,,,,,,,,,,,,,,,,
,,,,,,,,,,,,,,,,,,,,,,,,,yes,,,,,,,,,,,,,,,,,,,,,,,,,2018-12-31,,,,,,,,,,,,,,0.40,,,,,,,,,,,,,,,,,,6,6,,,,Full application for development of 6 homes through change of use permitted September 2017 - 16/04562/FUL,,,,,,local-authority-eng:NBL,,not owned by a public authority,,,,,,,,2017-09-06,https://publicaccess.northumberland.gov.uk/online-applications/propertyDetails.do?activeTab=relatedCases&keyVal=000BAGTGLI000,permissioned,full planning permission,,,,,,,,,,,,,,,,,,,,,,9055,"""FS Vickers and Son, Rennington""",http://northumberland.maps.arcgis.com/apps/webappviewer/index.html?id=c1b801d50f8040efbf8c9bc9f916cfae,,,2017-12-17,,,,,,,,,,,,,,,,,,,,,,,,,,
