,,,,,,,,,,,,,,,,,,,,,,,,,,,,,,,,,,,,,,,,,,,,,,,,,,2017-12-17,,,,,,,,,,,,,,0.94,,,,,,,,,,,,,,,,,,18,18,,,,"A number of applications have been permitted for change of use of existing business, but only relating to a small area of the site - 17/02027/COU, 16/01664/COU",,,,,,local-authority-eng:NBL,,,,,,,,,,,,not permissioned,,,,,,,,,,,,,,,,,,,,,,,1516,"""Berwick Eastern Arc - The Quayside, Berwick-upon-Tweed""",http://northumberland.maps.arcgis.com/apps/webappviewer/index.html?id=c1b801d50f8040efbf8c9bc9f916cfae,,,2017-12-17,,,,,,,,,,,,,,,,,,,,,,,,,,
,,,,,,,,,,,,,,,,,,,,,,,,,,,,,,,,,,,,,,,,,,,,,,,,,,2017-12-17,,,,,,,,,,,,,,0.21,,,,,,,,,,,,,,,,,,5,5,,,,"Previous application refused for 33 two- and three-bed two-storey dwellings across whole site, following demolition of school encompassing both brownfield and greenfield land - 17/03961/FUL",,,,,,local-authority-eng:NBL,,owned by a public authority,,,,,,,,,https://publicaccess.northumberland.gov.uk/online-applications/propertyDetails.do?activeTab=relatedCases&keyVal=L071V6QS03X00,not permissioned,,,,,,,,,,,,,,,,,,,,,,,1518x,"""Milfield First School Site, Wheatriggs, Milfield (brownfield parcel)""",http://northumberland.maps.arcgis.com/apps/webappviewer/index.html?id=c1b801d50f8040efbf8c9bc9f916cfae,,,2017-12-17,,,,,,,,,,,,,,,,,,,,,,,,,,
,,,,,,,,,,,,,,,,,,,,,,,,,,,,,,,,,,,,,,,,,,,,,,,,,,2017-12-17,,,,,,,,,,,,,,0.31,,,,,,,,,,,,,,,,,,7,7,,,,No relevant planning history,,,,,,local-authority-eng:NBL,,owned by a public authority,,,,,,,,,,not permissioned,,,,,,,,,,,,,,,,,,,,,,,1539,"""5 Palace Street East, Berwick-upon-Tweed""",http://northumberland.maps.arcgis.com/apps/webappviewer/index.html?id=c1b801d50f8040efbf8c9bc9f916cfae,,,2016-06-30,,,,,,,,,,,,,,,,,,,,,,,,,,
,,,,,,,,,,,,,,,,,,,,,,,,,,,,,,,,,,,,,,,,,,,,,,,,,,2018-12-31,,,,,,,,,,,,,,0.22,,,,,,,,,,,,,,,,,,6,6,,,,Permission for demolition of fire station and construction of 5 dwellings - 17/02577/FUL,,,,,,local-authority-eng:NBL,,not owned by a public authority,,,,,,,,2018-05-18,https://publicaccess.northumberland.gov.uk/online-applications/propertyDetails.do?activeTab=relatedCases&keyVal=00DSDBTGLI000,permissioned,full planning permission,,,,,,,,,,,,,,,,,,,,,,2024,"""Haydon Bridge Fire Station, Station Road, Haydon Road""",http://northumberland.maps.arcgis.com/apps/webappviewer/index.html?id=c1b801d50f8040efbf8c9bc9f916cfae,,,2017-12-17,,,,,,,,,,,,,,,,,,,,,,,,,,
,,,,,,,,,,,,,,,,,,,,,,,,,,,,,,,,,,,,,,,,,,,,,,,,,,2018-12-31,,,,,,,,,,,,,,0.40,,,,,,,,,,,,,,,,,,12,12,,,,Draft Local Plan housing site allocation - reflected in emerging draft Hexham Neighbourhood Plan.,,,,,,local-authority-eng:NBL,,not owned by a public authority,,,,,,,,,,not permissioned,,,,,,,,,,,,,,,,,,,,,,,2040,"""Burn Lane Bus Depot, Hexham""",http://northumberland.maps.arcgis.com/apps/webappviewer/index.html?id=c1b801d50f8040efbf8c9bc9f916cfae,,,2017-12-17,,,,,,,,,,,,,,,,,,,,,,,,,,
,,,,,,,,,,,,,,,,,,,,,,,,,,,,,,,,,,,,,,,,,,,,,,,,,,2018-12-31,,,,,,,,,,,,,,0.26,,,,,,,,,,,,,,,,,,5,5,,,,Draft Local Plan housing site allocation. Permission for development of 8 dwellings previously secured but lapsed - T/20070552,,,,,,local-authority-eng:NBL,,not owned by a public authority,,,,,,,,2008-07-10,https://publicaccess.northumberland.gov.uk/online-applications/propertyDetails.do?activeTab=relatedCases&keyVal=N8SVZDQS0CE00,not permissioned,,,,,,,,,,,,,,,,,,,,,,,2065,"""West Woodburn Filling Station""",http://northumberland.maps.arcgis.com/apps/webappviewer/index.html?id=c1b801d50f8040efbf8c9bc9f916cfae,,,2016-06-30,,,,,,,,,,,,,,,,,,,,,,,,,,
,,,,,,,,,,,,,,,,,,,,,,,,,,,,,,,,,,,,,,,,,,,,,,,,,,2017-12-17,,,,,,,,,,,,,,0.98,,,,,,,,,,,,,,,,,,18,18,,,,No relevant planning history,,,,,,local-authority-eng:NBL,,not owned by a public authority,,,,,,,,,,not permissioned,,,,,,,,,,,,,,,,,,,,,,,2076,"""Farmways Site, Corbridge Road, Hexham""",http://northumberland.maps.arcgis.com/apps/webappviewer/index.html?id=c1b801d50f8040efbf8c9bc9f916cfae,,,2016-06-30,,,,,,,,,,,,,,,,,,,,,,,,,,
,,,,,,,,,,,,,,,,,,,,,,,,,,,,,,,,,,,,,,,,,,,,,,,,,,2018-12-31,,,,,,,,,,,,,,0.90,,,,,,,,,,,,,,,,,,27,27,,,,Draft Local Plan housing site allocation. Pre-app for development of 35 homes has been submitted for consideration in 2018. Previous permission for development of 57 sheltered apartments not been taken forward and has now lapsed -  T/20100529 (ENRP314),,,,,,local-authority-eng:NBL,,,,,,,,,,2011-04-28,https://publicaccess.northumberland.gov.uk/online-applications/propertyDetails.do?activeTab=relatedCases&keyVal=00D9TZTGLI000,not permissioned,,,,,,,,,,,,,,,,,,,,,,,2187,"""Greystonedale Park Road, Haltwhistle""",http://northumberland.maps.arcgis.com/apps/webappviewer/index.html?id=c1b801d50f8040efbf8c9bc9f916cfae,,,2016-06-30,,,,,,,,,,,,,,,,,,,,,,,,,,
,,,,,,,,,,,,,,,,,,,,,,,,,,,,,,,,,,,,,,,,,,,,,,,,,,2018-12-31,,,,,,,,,,,,,,0.16,,,,,,,,,,,,,,,,,,5,5,,,,Draft Local Plan housing site allocation. Planning permission for 6 two-storey dwellings on site has now lapsed - T/20100032. This consent extended the time limit of an original outline consent - T/20070154,,,,,,local-authority-eng:NBL,,,,,,,,,,2007-04-05,https://publicaccess.northumberland.gov.uk/online-applications/propertyDetails.do?activeTab=relatedCases&keyVal=00DVJSTGLI000,not permissioned,,,,,,,,,,,,,,,,,,,,,,,2247,"""Land West of Hougill, Tyneview Road, Haltwhistle""",http://northumberland.maps.arcgis.com/apps/webappviewer/index.html?id=c1b801d50f8040efbf8c9bc9f916cfae,,,2016-06-30,,,,,,,,,,,,,,,,,,,,,,,,,,
,,,,,,,,,,,,,,,,,,,,,,,,,yes,,,,,,,,,,,,,,,,,,,,,,,,,2017-12-17,,,,,,,,,,,,,,0.12,,,,,,,,,,,,,,,,,,0,0,,,,"Proposal for mixed development including 36 apartments covering Sites 2497 and 2258,, through reconstruction of exisiting builidng to create 5 dwellings and provision of two apartment blocks providing 16 and 15 apartments respectively, consented - 15/02794/FUL. Scheme. Previous permission for 17 apartments lapsed without implementation - T/20061115",,,,,,local-authority-eng:NBL,,not owned by a public authority,,,,,,,,2015-11-18,https://publicaccess.northumberland.gov.uk/online-applications/propertyDetails.do?activeTab=relatedCases&keyVal=00DSZKTGLI000,permissioned,full planning permission,,,,,,,,,,,,,,,,,,,,,,2258,"""Land to the rear of 13-17 Priestpopple, Hexham""",http://northumberland.maps.arcgis.com/apps/webappviewer/index.html?id=c1b801d50f8040efbf8c9bc9f916cfae,,,2016-06-30,,,,,,,,,,,,,,,,,,,,,,,,,,
,,,,,,,,,,,,,,,,,,,,,,,,,,,,,,,,,,,,,,,,,,,,,,,,,,2017-12-17,,,,,,,,,,,,,,0.14,,,,,,,,,,,,,,,,,,43,43,,,,Permission in place for part demolition of existing buildings and development of 45 apartments (43 net) for 'later living' - 13/02289/FUL. Planning permission has technically been implemented through commencement of site works but the scheme is no longer to be delivered,,,,,,local-authority-eng:NBL,,,,,,,,,,2015-02-02,https://publicaccess.northumberland.gov.uk/online-applications/propertyDetails.do?activeTab=relatedCases&keyVal=MR5LY5QS0CE01,permissioned,full planning permission,,,,,,,,,,,,,,,,,,,,,,2343,"""Swimming Pool, Market Street, Hexham""",http://northumberland.maps.arcgis.com/apps/webappviewer/index.html?id=c1b801d50f8040efbf8c9bc9f916cfae,,,2016-06-30,,,,,,,,,,,,,,,,,,,,,,,,,,
,,,,,,,,,,,,,,,,,,,,,,,,,,,,,,,,,,,,,,,,,,,,,,,,,,2018-12-31,,,,,,,,,,,,,,1.15,,,,,,,,,,,,,,,,,,37,37,,,,Draft Local Plan housing site allocation - reflected in emerging draft Hexham Neighbourhood Plan. Saved Tynedale Local Plan allocation for residential development. Two pre-apps have been submitted for consideration in 2018 . First for conversion of and extension of existing buildings to 33 apartments on the western part of the site. Second for 48 retirement apartments on the eastern section.,,,,,,local-authority-eng:NBL,,owned by a public authority,,,,,,,,,,not permissioned,,,,,,,,,,,,,,,,,,,,,,,2345,"""Hospital land at Dean Street, Hexham""",http://northumberland.maps.arcgis.com/apps/webappviewer/index.html?id=c1b801d50f8040efbf8c9bc9f916cfae,,,2016-06-30,,,,,,,,,,,,,,,,,,,,,,,,,,
,,,,,,,,,,,,,,,,,,,,,,,,,,,,,,,,,,,,,,,,,,,,,,,,,,2018-12-31,,,,,,,,,,,,,,1.72,,,,,,,,,,,,,,,,,,59,59,,,,Draft Local Plan housing site allocation. Reserved matters consent for residential scheme of 65 units lapsed without being taken forward - T/20071304. Relates to original outline application - T/20050571,,,,,,local-authority-eng:NBL,,not owned by a public authority,,,,,,,,2008-02-21,https://publicaccess.northumberland.gov.uk/online-applications/propertyDetails.do?activeTab=relatedCases&keyVal=00DA9LTGLI000,not permissioned,,,,,,,,,,,,,,,,,,,,,,,2352,"""Former Bellingham Auction Mart, Bellingham""",http://northumberland.maps.arcgis.com/apps/webappviewer/index.html?id=c1b801d50f8040efbf8c9bc9f916cfae,,,2016-06-30,,,,,,,,,,,,,,,,,,,,,,,,,,
,,,,,,,,,,,,,,,,,,,,,,,,,yes,,,,,,,,,,,,,,,,,,,,,,,,,2018-12-31,,,,,,,,,,,,,,0.09,,,,,,,,,,,,,,,,,,9,9,,,,Latest application for revised scheme 9 units was permitted in September 2017 - 17/01547/FUL. This will supersede previous scheme approved for 6 dwellings - 13/03434/FUL,,,,,,local-authority-eng:NBL,,,,,,,,,,2017-09-28,https://publicaccess.northumberland.gov.uk/online-applications/propertyDetails.do?activeTab=relatedCases&keyVal=00DSDMTGLI000,permissioned,full planning permission,,,,,,,,,,,,,,,,,,,,,,2353,"""Anchor Garage, Shaftoe Street, Haydon Bridge""",http://northumberland.maps.arcgis.com/apps/webappviewer/index.html?id=c1b801d50f8040efbf8c9bc9f916cfae,,,2016-06-30,,,,,,,,,,,,,,,,,,,,,,,,,,
,,,,,,,,,,,,,,,,,,,,,,,,,,,,,,,,,,,,,,,,,,,,,,,,,,2017-12-17,,,,,,,,,,,,,,0.12,,,,,,,,,,,,,,,,,,5,5,,,,Planning permission for development of 5 terraced homes has lapsed - T/20070337,,,,,,local-authority-eng:NBL,,,,,,,,,,2007-05-09,https://publicaccess.northumberland.gov.uk/online-applications/propertyDetails.do?activeTab=relatedCases&keyVal=NF6VZIQS0CE00,not permissioned,,,,,,,,,,,,,,,,,,,,,,,2356,"""6-10 South View, Mickley Square""",http://northumberland.maps.arcgis.com/apps/webappviewer/index.html?id=c1b801d50f8040efbf8c9bc9f916cfae,,,2016-06-30,,,,,,,,,,,,,,,,,,,,,,,,,,
,,,,,,,,,,,,,,,,,,,,,,,,,,,,,,,,,,,,,,,,,,,,,,,,,,2017-12-17,,,,,,,,,,,,,,0.49,,,,,,,,,,,,,,,,,,5,5,,,,Saved Tynedale Local Plan allocation for 10 dwellings covers part of site,,,,,,local-authority-eng:NBL,,,,,,,,,,,,not permissioned,,,,,,,,,,,,,,,,,,,,,,,2379x,"""Bearsbridge Sawmill (brownfield parcel)""",http://northumberland.maps.arcgis.com/apps/webappviewer/index.html?id=c1b801d50f8040efbf8c9bc9f916cfae,,,2017-12-17,,,,,,,,,,,,,,,,,,,,,,,,,,
,,,,,,,,,,,,,,,,,,,,,,,,,,,,,,,,,,,,,,,,,,,,,,,,,,2017-12-17,,,,,,,,,,,,,,1.45,,,,,,,,,,,,,,,,,,27,27,,,,Outline permission for residential development of up to 50 homes secured but now lapsed - T/20041143. Subsequent application submitted in 2011 but now disposed. Saved Tynedale Local Plan allocation for 30 dwellings,,,,,,local-authority-eng:NBL,,,,,,,,,,2008-05-29,https://publicaccess.northumberland.gov.uk/online-applications/propertyDetails.do?activeTab=relatedCases&keyVal=00DA92TGLI000,not permissioned,,,,,,,,,,,,,,,,,,,,,,,2399,"""Former Goods Yard to the West of Haltwhistle Station, Tyne View Road, Haltwhistle""",http://northumberland.maps.arcgis.com/apps/webappviewer/index.html?id=c1b801d50f8040efbf8c9bc9f916cfae,,,2017-12-17,,,,,,,,,,,,,,,,,,,,,,,,,,
,,,,,,,,,,,,,,,,,,,,,,,,,,,,,,,,,,,,,,,,,,,,,,,,,,2018-12-31,,,,,,,,,,,,,,3.49,,,,,,,,,,,,,,,,,,18,18,,,,"Allocated employment site in rural location, but proposed for deallocation in the draft Local Plan. Full application now pending consideration for the redevelopment of the Former Marley Tiles Factory to provide a residential development of 109 houses",,,,,,local-authority-eng:NBL,,,,,,,,,,,,pending decision,,,,,,,,,,,,,,,,,,,,,,,2470x,"""Newlands (brownfield parcel)""",http://northumberland.maps.arcgis.com/apps/webappviewer/index.html?id=c1b801d50f8040efbf8c9bc9f916cfae,,,2017-12-17,,,,,,,,,,,,,,,,,,,,,,,,,,
,,,,,,,,,,,,,,,,,,,,,,,,,yes,,,,,,,,,,,,,,,,,,,,,,,,,2018-12-31,,,,,,,,,,,,,,0.16,,,,,,,,,,,,,,,,,,32,32,,,,"Previous proposal now lapsed for mixed development including 36 apartments covering Sites 2497 and 2258, through reconstruction of exisiting building to create 5 dwellings and provision of two apartment blocks providing 16 and 15 apartments respectively - 15/02794/FUL. Previous permission for 17 apartments lapsed without implementation - T/20061115",,,,,,local-authority-eng:NBL,,owned by a public authority,,,,,,,,,https://publicaccess.northumberland.gov.uk/online-applications/propertyDetails.do?activeTab=relatedCases&keyVal=00DSZKTGLI000,not permissioned,,,,,,,,,,,,,,,,,,,,,,,2497,"""Bus Station Site, Priestpopple, Hexham""",http://northumberland.maps.arcgis.com/apps/webappviewer/index.html?id=c1b801d50f8040efbf8c9bc9f916cfae,,,2016-06-30,,,,,,,,,,,,,,,,,,,,,,,,,,
,,,,,,,,,,,,,,,,,,,,,,,,,,,,,,,,,,,,,,,,,,,,,,,,,,2017-12-17,,,,,,,,,,,,,,0.35,,,,,,,,,,,,,,,,,,7,7,,,,No relevant planning history,,,,,,local-authority-eng:NBL,,not owned by a public authority,,,,,,,,,,not permissioned,,,,,,,,,,,,,,,,,,,,,,,2536,"""Coal Cells at Haydon Bridge Railway Station (3), Haydon Bridge""",http://northumberland.maps.arcgis.com/apps/webappviewer/index.html?id=c1b801d50f8040efbf8c9bc9f916cfae,,,2016-06-30,,,,,,,,,,,,,,,,,,,,,,,,,,
,,,,,,,,,,,,,,,,,,,,,,,,,,,,,,,,,,,,,,,,,,,,,,,,,,2017-12-17,,,,,,,,,,,,,,0.24,,,,,,,,,,,,,,,,,,5,5,,,,Application relating to part of site approved for development of a single dwelling - 15/03735/FUL,,,,,,local-authority-eng:NBL,,not owned by a public authority,,,,,,,,,https://publicaccess.northumberland.gov.uk/online-applications/propertyDetails.do?activeTab=relatedCases&keyVal=NWB0UWQS0GA00,not permissioned,,,,,,,,,,,,,,,,,,,,,,,2554x,"""West Orchard House, Allendale Road, Hexham (brownfield parcel)""",http://northumberland.maps.arcgis.com/apps/webappviewer/index.html?id=c1b801d50f8040efbf8c9bc9f916cfae,,,2017-12-17,,,,,,,,,,,,,,,,,,,,,,,,,,
,,,,,,,,,,,,,,,,,,,,,,,,,,,,,,,,,,,,,,,,,,,,,,,,,,2017-12-17,,,,,,,,,,,,,,0.42,,,,,,,,,,,,,,,,,,8,8,,,,No relevant planning history,,,,,,local-authority-eng:NBL,,not owned by a public authority,,,,,,,,,,not permissioned,,,,,,,,,,,,,,,,,,,,,,,2610,"""The Old School, Bellingham""",http://northumberland.maps.arcgis.com/apps/webappviewer/index.html?id=c1b801d50f8040efbf8c9bc9f916cfae,,,2017-12-17,,,,,,,,,,,,,,,,,,,,,,,,,,
,,,,,,,,,,,,,,,,,,,,,,,,,,,,,,,,,,,,,,,,,,,,,,,,,,2018-12-31,,,,,,,,,,,,,,0.18,,,,,,,,,,,,,,,,,,9,9,,,,Application minded to approve for proposed change of use to provide 18 units - 17/04070/FUL. Previous application for 20 units withdrawn in July 2017 - 17/01438/FUL,,,,,,local-authority-eng:NBL,,,,,,,,,,,https://publicaccess.northumberland.gov.uk/online-applications/propertyDetails.do?activeTab=relatedCases&keyVal=00DSWWTGLI000,pending decision,,,,,,,,,,,,,,,,,,,,,,,2739,"""Prospect House (Council Offices), Hallgate, Hexham""",http://northumberland.maps.arcgis.com/apps/webappviewer/index.html?id=c1b801d50f8040efbf8c9bc9f916cfae,,,2016-06-30,,,,,,,,,,,,,,,,,,,,,,,,,,
,,,,,,,,,,,,,,,,,,,,,,,,,,,,,,,,,,,,,,,,,,,,,,,,,,2017-12-17,,,,,,,,,,,,,,1.67,,,,,,,,,,,,,,,,,,27,27,,,,No relevant planning history,,,,,,local-authority-eng:NBL,,,,,,,,,,,,not permissioned,,,,,,,,,,,,,,,,,,,,,,,3000,"""Scots Gap Auction Mart, Scots Gap""",http://northumberland.maps.arcgis.com/apps/webappviewer/index.html?id=c1b801d50f8040efbf8c9bc9f916cfae,,,2016-06-30,,,,,,,,,,,,,,,,,,,,,,,,,,
,,,,,,,,,,,,,,,,,,,,,,,,,,,,,,,,,,,,,,,,,,,,,,,,,,2018-12-31,,,,,,,,,,,,,,0.56,,,,,,,,,,,,,,,,,,15,15,,,,"Full application pending for conversion of Grade II listed East Farm Barns into 2 dwellings, change of use of former shop into cafe,  refurbishment of existing flat above cafe and for 28 additional dwellings - relates to sites 3017, 9114 and 9115. Previous outline application for approximately 17 dwellings disposed without determination - 15/04203/OUT.",,,,,,local-authority-eng:NBL,,not owned by a public authority,,,,,,,,,https://publicaccess.northumberland.gov.uk/online-applications/propertyDetails.do?activeTab=relatedCases&keyVal=NGO7HEQS0CE00,pending decision,,,,,,,,,,,,,,,,,,,,,,,3017,"""East Farm & Factory Unit, Longhirst Road, Pegswood""",http://northumberland.maps.arcgis.com/apps/webappviewer/index.html?id=c1b801d50f8040efbf8c9bc9f916cfae,,,2017-12-17,,,,,,,,,,,,,,,,,,,,,,,,,,
,,,,,,,,,,,,,,,,,,,,,,,,,,,,,,,,,,,,,,,,,,,,,,,,,,2018-12-31,,,,,,,,,,,,,,0.39,,,,,,,,,,,,,,,,,,12,12,,,,"Permission for development of 18 homes, through conversion of existing Grade II listed building to accommodate 13 self contained residential apartments and development of 3 three-bed and a four-bed dormer bungalows - 17/00884/FUL",,,,,,local-authority-eng:NBL,,owned by a public authority,,,,,,,,2018-01-18,https://publicaccess.northumberland.gov.uk/online-applications/propertyDetails.do?activeTab=relatedCases&keyVal=00BCBDTGLI000,permissioned,full planning permission,,,,,,,,,,,,,,,,,,,,,,3024,"""NCC Council Offices, Newgate Street, Morpeth""",http://northumberland.maps.arcgis.com/apps/webappviewer/index.html?id=c1b801d50f8040efbf8c9bc9f916cfae,,,2017-12-17,,,,,,,,,,,,,,,,,,,,,,,,,,
,,,,,,,,,,,,,,,,,,,,,,,,,,,,,,,,,,,,,,,,,,,,,,,,,,2017-12-17,,,,,,,,,,,,,,0.69,,,,,,,,,,,,,,,,,,9,9,,,,No relevant planning history,,,,,,local-authority-eng:NBL,,,,,,,,,,,,not permissioned,,,,,,,,,,,,,,,,,,,,,,,3035,"""Lynemouth Scrapyard, Albion Terrace, Lynemouth""",http://northumberland.maps.arcgis.com/apps/webappviewer/index.html?id=c1b801d50f8040efbf8c9bc9f916cfae,,,2016-06-30,,,,,,,,,,,,,,,,,,,,,,,,,,
,,,,,,,,,,,,,,,,,,,,,,,,,,,,,,,,,,,,,,,,,,,,,,,,,,2017-12-17,,,,,,,,,,,,,,0.33,,,,,,,,,,,,,,,,,,7,7,,,,No relevant planning history,,,,,,local-authority-eng:NBL,,,,,,,,,,,,not permissioned,,,,,,,,,,,,,,,,,,,,,,,3036,"""Queen Street Garages, Park Road, Lynemouth""",http://northumberland.maps.arcgis.com/apps/webappviewer/index.html?id=c1b801d50f8040efbf8c9bc9f916cfae,,,2016-06-30,,,,,,,,,,,,,,,,,,,,,,,,,,
,,,,,,,,,,,,,,,,,,,,,,,,,,,,,,,,,,,,,,,,,,,,,,,,,,2017-12-17,,,,,,,,,,,,,,0.01,,,,,,,,,,,,,,,,,,0,0,,,,"Permitted application, across Sites 3049 and 3076 not implemented, involved demolition of existing buildings and new build scheme of 6 apartments, but has lapsed - CM/20090251 . Previous application withdrawn - CM/20080727",,,,,,local-authority-eng:NBL,,,,,,,,,,2009-06-05,https://publicaccess.northumberland.gov.uk/online-applications/propertyDetails.do?activeTab=relatedCases&keyVal=00BD53TGLI000,not permissioned,,,,,,,,,,,,,,,,,,,,,,,3049,"""Post Office, West Market Street, Lynemouth""",http://northumberland.maps.arcgis.com/apps/webappviewer/index.html?id=c1b801d50f8040efbf8c9bc9f916cfae,,,2016-06-30,,,,,,,,,,,,,,,,,,,,,,,,,,
,,,,,,,,,,,,,,,,,,,,,,,,,,,,,,,,,,,,,,,,,,,,,,,,,,2017-12-17,,,,,,,,,,,,,,2.61,,,,,,,,,,,,,,,,,,53,53,,,,"Outline application for development of 65 homes following demolition, relating to Sites 3052 (in part) and 3053, currently pending consideration - 17/01887/OUT",,,,,,local-authority-eng:NBL,,,,,,,,,,,https://publicaccess.northumberland.gov.uk/online-applications/propertyDetails.do?activeTab=relatedCases&keyVal=LITDLCQS04P00,pending decision,,,,,,,,,,,,,,,,,,,,,,,3052,"""Hadston Industrial Estate (North), Hadston""",http://northumberland.maps.arcgis.com/apps/webappviewer/index.html?id=c1b801d50f8040efbf8c9bc9f916cfae,,,2017-12-17,,,,,,,,,,,,,,,,,,,,,,,,,,
,,,,,,,,,,,,,,,,,,,,,,,,,,,,,,,,,,,,,,,,,,,,,,,,,,2017-12-17,,,,,,,,,,,,,,0.19,,,,,,,,,,,,,,,,,,7,7,,,,No relevant planning history,,,,,,local-authority-eng:NBL,,,,,,,,,,,,not permissioned,,,,,,,,,,,,,,,,,,,,,,,3059,"""Benfield VW Garage, Castle Bank, Morpeth""",http://northumberland.maps.arcgis.com/apps/webappviewer/index.html?id=c1b801d50f8040efbf8c9bc9f916cfae,,,2017-12-17,,,,,,,,,,,,,,,,,,,,,,,,,,
,,,,,,,,,,,,,,,,,,,,,,,,,,,,,,,,,,,,,,,,,,,,,,,,,,2017-12-17,,,,,,,,,,,,,,0.23,,,,,,,,,,,,,,,,,,8,8,,,,Proposed change of use from gas works site to open storage approved in 2016 - 16/00598/FUL,,,,,,local-authority-eng:NBL,,,,,,,,,,,https://publicaccess.northumberland.gov.uk/online-applications/propertyDetails.do?activeTab=relatedCases&keyVal=NQHWAXQS0GA00,not permissioned,,,,,,,,,,,,,,,,,,,,,,,3068,"""Gas Works, Gas House Lane, Morpeth""",http://northumberland.maps.arcgis.com/apps/webappviewer/index.html?id=c1b801d50f8040efbf8c9bc9f916cfae,,,2017-12-17,,,,,,,,,,,,,,,,,,,,,,,,,,
,,,,,,,,,,,,,,,,,,,,,,,,,,,,,,,,,,,,,,,,,,,,,,,,,,2017-12-17,,,,,,,,,,,,,,0.56,,,,,,,,,,,,,,,,,,18,18,,,,"Application currently pending for proposed development of 32 units, through refurbishment and change of use into 6 houses and the demolition for new build construction of 7 houses and 19 apartments - 17/02588/FUL",,,,,,local-authority-eng:NBL,,,,,,,,,,,https://publicaccess.northumberland.gov.uk/online-applications/propertyDetails.do?activeTab=relatedCases&keyVal=00BCWETGLI000,pending decision,,,,,,,,,,,,,,,,,,,,,,,3069,"""Goose Hill Police Station, Castle Bank, Morpeth""",http://northumberland.maps.arcgis.com/apps/webappviewer/index.html?id=c1b801d50f8040efbf8c9bc9f916cfae,,,2017-12-17,,,,,,,,,,,,,,,,,,,,,,,,,,
,,,,,,,,,,,,,,,,,,,,,,,,,yes,,,,,,,,,,,,,,,,,,,,,,,,,2018-12-31,,,,,,,,,,,,,,20.80,,,,,,,,,,,,,,,,,,282,282,,,,"Hybrid full and outline permissions for large mixed-use scheme, including up to 875 dwellings and a wide variety of supporting infrastructure, services and facilities - 16/00994/FULES",,,,,,local-authority-eng:NBL,,,,,,,,,,2018-05-04,https://publicaccess.northumberland.gov.uk/online-applications/propertyDetails.do?activeTab=relatedCases&keyVal=NOP3EVQS0GA00,permissioned,full planning permission,,,,,,,,,,,,,,,,,,,,,,3074x,"""St George's Hospital (land north), Morpeth (brownfield parcel)""",http://northumberland.maps.arcgis.com/apps/webappviewer/index.html?id=c1b801d50f8040efbf8c9bc9f916cfae,,,2017-12-17,,,,,,,,,,,,,,,,,,,,,,,,,,
,,,,,,,,,,,,,,,,,,,,,,,,,,,,,,,,,,,,,,,,,,,,,,,,,,2017-12-17,,,,,,,,,,,,,,0.05,,,,,,,,,,,,,,,,,,5,5,,,,"Permitted application, across Sites 3049 and 3076 not implemented, involved demolition of existing buildings and new build scheme of 6 apartments, but has lapsed - CM/20090251 . Previous application withdrawn - CM/20080727",,,,,,local-authority-eng:NBL,,,,,,,,,,2009-06-05,https://publicaccess.northumberland.gov.uk/online-applications/propertyDetails.do?activeTab=relatedCases&keyVal=00BD53TGLI000,not permissioned,,,,,,,,,,,,,,,,,,,,,,,3076,"""Lynemouth Garage, West Market Street, Lynemouth""",http://northumberland.maps.arcgis.com/apps/webappviewer/index.html?id=c1b801d50f8040efbf8c9bc9f916cfae,,,2016-06-30,,,,,,,,,,,,,,,,,,,,,,,,,,
,,,,,,,,,,,,,,,,,,,,,,,,,yes,,,,,,,,,,,,,,,,,,,,,,,,,2018-12-31,,,,,,,,,,,,,,0.08,,,,,,,,,,,,,,,,,,25,25,,,,Full application for development of 25 apartments in two blocks approved August 2017 - 16/04427/FUL,,,,,,local-authority-eng:NBL,,not owned by a public authority,,,,,,,,2017-08-24,https://publicaccess.northumberland.gov.uk/online-applications/propertyDetails.do?activeTab=relatedCases&keyVal=00BC75TGLI000,permissioned,full planning permission,,,,,,,,,,,,,,,,,,,,,,3084,"""Ponteland Library, Thornhill Road, Ponteland""",http://northumberland.maps.arcgis.com/apps/webappviewer/index.html?id=c1b801d50f8040efbf8c9bc9f916cfae,,,2017-12-17,,,,,,,,,,,,,,,,,,,,,,,,,,
,,,,,,,,,,,,,,,,,,,,,,,,,,,,,,,,,,,,,,,,,,,,,,,,,,2017-12-17,,,,,,,,,,,,,,42.83,,,,,,,,,,,,,,,,,,180,180,,,,"Outline application for mixed-use scheme, including up to 200 homes, employment and community uses, currently pending a decision - CM/20090157",,,,,,local-authority-eng:NBL,,not owned by a public authority,,,,,,,,2008-02-20,https://publicaccess.northumberland.gov.uk/online-applications/propertyDetails.do?activeTab=relatedCases&keyVal=KHOJ57LW00500,pending decision,,,,,,,,,,,,,,,,,,,,,,,3101,"""Lynemouth Conveyor (south), Lynemouth""",http://northumberland.maps.arcgis.com/apps/webappviewer/index.html?id=c1b801d50f8040efbf8c9bc9f916cfae,,,2016-06-30,,,,,,,,,,,,,,,,,,,,,,,,,,
,,,,,,,,,,,,,,,,,,,,,,,,,,,,,,,,,,,,,,,,,,,,,,,,,,2017-12-17,,,,,,,,,,,,,,0.17,,,,,,,,,,,,,,,,,,5,5,,,,"Proposal for a part change of use from garage to residential use, providing 10 dwellings, withdrawn in June 2017 - 15/04227/FUL",,,,,,local-authority-eng:NBL,,,,,,,,,,,https://publicaccess.northumberland.gov.uk/online-applications/propertyDetails.do?activeTab=relatedCases&keyVal=MALFAQQS04N01,not permissioned,,,,,,,,,,,,,,,,,,,,,,,3133,"""Pegswood Garage (former), Longhirst Road, Pegswood""",http://northumberland.maps.arcgis.com/apps/webappviewer/index.html?id=c1b801d50f8040efbf8c9bc9f916cfae,,,2016-06-30,,,,,,,,,,,,,,,,,,,,,,,,,,
,,,,,,,,,,,,,,,,,,,,,,,,,,,,,,,,,,,,,,,,,,,,,,,,,,2017-12-17,,,,,,,,,,,,,,0.59,,,,,,,,,,,,,,,,,,14,14,,,,Scheme was consented for 5 detached dwellings but permission has now lapsed - 10/S/00036/VARYCO. This extended the time limit of original application - 03/D/0614 and CM/20061032,,,,,,local-authority-eng:NBL,,not owned by a public authority,,,,,,,,2010-03-26,https://publicaccess.northumberland.gov.uk/online-applications/propertyDetails.do?activeTab=relatedCases&keyVal=KIECRULW00500,not permissioned,,,,,,,,,,,,,,,,,,,,,,,3325,"""Garage Site, Fourth Row, Linton""",http://northumberland.maps.arcgis.com/apps/webappviewer/index.html?id=c1b801d50f8040efbf8c9bc9f916cfae,,,2016-06-30,,,,,,,,,,,,,,,,,,,,,,,,,,
,,,,,,,,,,,,,,,,,,,,,,,,,,,,,,,,,,,,,,,,,,,,,,,,,,2018-12-31,,,,,,,,,,,,,,0.67,,,,,,,,,,,,,,,,,,8,8,,,,Previous application for proposed redevelopment for 9 homes withdrawn - 17/00204/FUL. A previous application from 2009 for demolition and development of 13 homes remains to be determined - CM/20070970,,,,,,local-authority-eng:NBL,,not owned by a public authority,,,,,,,,,https://publicaccess.northumberland.gov.uk/online-applications/propertyDetails.do?activeTab=relatedCases&keyVal=00AW4TTGLI000,not permissioned,,,,,,,,,,,,,,,,,,,,,,,3358,"""Karva Furniture, Grangemoor Road, Widdrington Station""",http://northumberland.maps.arcgis.com/apps/webappviewer/index.html?id=c1b801d50f8040efbf8c9bc9f916cfae,,,2016-06-30,,,,,,,,,,,,,,,,,,,,,,,,,,
