entry-date,organisation,site,site-address,site-plan-url,deliverable,ownership,planning-permission-status,planning-permission-type,hazardous-substances,latitude,longitude,hectares,minimum-net-dwellings,maximum-net-dwellings,start-date,end-date,notes,resource
2017-12-18,local-authority-eng:STO,BR001,"Garage court rear of Marybrook Street car park, Marybrook Street Berkeley","https://stroud.maps.arcgis.com/apps/webappviewer/index.html?id=8d2cd204b79c4852b8d4365e24d16013&center=-2.4588082,51.692409&level=17",,owned by a public authority,not permissioned,,,51.692418,-2.458808,0.08,5,5,2017-12-18,,"Main constraints: Existing garage use.
Summary: The site is considered suitable for redevelopment for housing  subject to providing adequate car parking for existing residents and future occupants. There is a reasonable prospect that the site will be available in the future and that development as envisaged will be delivered on the site within 15 years.",7384d83065376a4fcccb0b25c840704e1012b3467420e0a609816540bda3ad17
2017-12-18,local-authority-eng:STO,BR002,"Queens Court, The Bourne Brimscombe","https://stroud.maps.arcgis.com/apps/webappviewer/index.html?id=8d2cd204b79c4852b8d4365e24d16013&center=-2.1764679,51.718852&level=17",,owned by a public authority,not permissioned,,,51.718852,-2.176453,0.44,30,30,2017-12-18,,"Main constraints: Demolition of existing building. 
Summary:  The site is considered to be deliverable for housing within five years. The site is available now and it is suitable for redevelopment for housing / community development.",7384d83065376a4fcccb0b25c840704e1012b3467420e0a609816540bda3ad17
2017-12-18,local-authority-eng:STO,BR003,"Brimscombe Mills & Mill Pond, London Road Brimscombe","https://stroud.maps.arcgis.com/apps/webappviewer/index.html?id=8d2cd204b79c4852b8d4365e24d16013&center=-2.1942217,51.720415&level=17",,not owned by a public authority,not permissioned,,,51.720424,-2.194207,1.46,25,25,2017-12-18,,"Main constraints: Brimscombe Mill Local Plan Site Allocations Policy SA1d; Regenerating existing employment sites Local Plan Delivery Policy EI2 (ER2), Industrial Heritage Conservation Area; flood risk, canal and site access. Site investigation required.
Summary: The site is allocated in the Local Plan for mixed use redevelopment and is considered suitable for housing/ community development and employment uses. Redevelopment should involve adapting and re-using surviving historic buildings. Most of the site is within Flood Zone 3 and the site should not be developed until the adjoining Cotswold Canal has been reinstated or until a site specific Flood Risk Assessment demonstrates that the site can be safely developed, with more vulnerable development being located within Flood Zone 1 and without increasing flood risk either on or off site. Access will require a solution that does not impact upon the planned route of the reopened canal. The site is available now and there is a reasonable prospect that development as envisaged will be delivered on the site within 15 years.",7384d83065376a4fcccb0b25c840704e1012b3467420e0a609816540bda3ad17
2017-12-18,local-authority-eng:STO,BR004,"Lakeside Depot, Brimscombe Mills London Road Stroud","https://stroud.maps.arcgis.com/apps/webappviewer/index.html?id=8d2cd204b79c4852b8d4365e24d16013&center=-2.1940208,51.720829&level=17",,not owned by a public authority,not permissioned,,,51.720838,-2.194021,0.24,15,15,2017-12-18,,"Main constraints: Brimscombe Mill Local Plan Site Allocations Policy SA1d; Regenerating existing employment sites Local Plan Delivery Policy EI2 (ER2), Industrial Heritage Conservation Area; flood risk, canal and site access. Site investigation required.
Summary: The site is allocated with adjacent land in the Local Plan for mixed use redevelopment and is considered suitable for redevelopment for housing / community development and employment uses with scope for adapting and re-using the surviving historic buildings on the southern half of the site. Access will require a solution that does not impact upon the planned route of the reopened canal. The site is available now.  and there is a reasonable prospect that development as envisaged will be delivered on the site within 15 years.",7384d83065376a4fcccb0b25c840704e1012b3467420e0a609816540bda3ad17
2017-12-18,local-authority-eng:STO,BR005,"Brimscombe Port, Port Lane Brimscombe","https://stroud.maps.arcgis.com/apps/webappviewer/index.html?id=8d2cd204b79c4852b8d4365e24d16013&center=-2.189743,51.719074&level=17",,owned by a public authority,not permissioned,,,51.719074,-2.189743,3.86,150,150,2017-12-18,,"Main constraints: Brimscombe Port Local Plan Site Allocations Policy SA1e; Regenerating existing employment sites Local Plan Delivery Policy EI2 (ER1), Industrial Heritage Conservation Area; listed buildings; Key Wildlife Site; flood risk. Site investigation required.
Summary:The site is allocated in the Local Plan for mixed use redevelopment and is considered suitable for redevelopment for housing /community and tourism development and employment uses. Development would require the demolition of some of the existing industrial buildings and sensitive reuse of historic buildings, together with redevelopment including the reinstatement of the canal and port basin. Most of the site is within Flood Zone 3 and the site should not be developed until the Cotswold Canal has been reinstated or until a site specific Flood Risk Assessment demonstrates that the site can be safely developed, with more vulnerable development being located within Flood Zone 1 and without increasing flood risk either on or off site.  The site is planned to come forward for redevelopment within the next 5 years and there is a reasonable prospect that development as envisaged will be delivered on the site within 15 years.",7384d83065376a4fcccb0b25c840704e1012b3467420e0a609816540bda3ad17
2017-12-18,local-authority-eng:STO,BR006,"Bourne Mills, London Road Brimscombe","https://stroud.maps.arcgis.com/apps/webappviewer/index.html?id=8d2cd204b79c4852b8d4365e24d16013&center=-2.1860462,51.717731&level=17",,,not permissioned,,,51.717731,-2.186046,0.47,10,10,2017-12-18,,"Main constraints:  Industrial Heritage Conservation Area; listed buildings,  Key Wildlife Site, flood risk and railway viaduct. Site investigation required.
Summary: The site is considered suitable for partial reuse, redevelopment and improvement for retail, employment, housing or community purposes, subject to conserving the character of the listed buildings and conservation area.The site is in active use but there is a reasonable prospect that parts of the site will be available for reuse/redevelopment at a point in the future and that development as envisaged will be delivered on the site within 15 years.",7384d83065376a4fcccb0b25c840704e1012b3467420e0a609816540bda3ad17
2017-12-18,local-authority-eng:STO,BR007,"Units 1-8, Ebley Wharf, Stroud","https://stroud.maps.arcgis.com/apps/webappviewer/index.html?id=8d2cd204b79c4852b8d4365e24d16013&center=-2.2493525,51.739858&level=17",,not owned by a public authority,pending decision,,,51.739858,-2.249352,0.16,6,6,2017-12-18,,"Main constraints:  Listed Buildings, Ebley Mills Conservation Area, adjoining canal, flood risk
Summary:  The site is considered to be deliverable for housing within five years. The site is available now and it is suitable for the conversion of existing buildings to a range of uses, including housing, subject to conserving the character of the listed buildings and conservation area.",7384d83065376a4fcccb0b25c840704e1012b3467420e0a609816540bda3ad17
2017-12-18,local-authority-eng:STO,BR008,"Coaley Junction, Draycott Cam","https://stroud.maps.arcgis.com/apps/webappviewer/index.html?id=8d2cd204b79c4852b8d4365e24d16013&center=-2.3647178,51.71635&level=17",,not owned by a public authority,not permissioned,,,51.71635,-2.364718,1.75,39,39,2017-12-18,,"Main constraints: Regenerating existing employment sites Local Plan Delivery Policy EI2 (ER6) and shape of site. Previous resolution to grant permission subject to conditions. Site investigation required.
Summary: The site is considered to be deliverable for a range of uses including housing within five years. The site is available now and is designated in the Local Plan as an existing employment site suitable for regeneration for mixed use development including housing and employment.",7384d83065376a4fcccb0b25c840704e1012b3467420e0a609816540bda3ad17
2017-12-18,local-authority-eng:STO,BR009,"20 Rock Road, Cam","https://stroud.maps.arcgis.com/apps/webappviewer/index.html?id=8d2cd204b79c4852b8d4365e24d16013&center=-2.3787456,51.69577&level=17",,not owned by a public authority,not permissioned,,,51.69577,-2.378746,0.09,8,8,2017-12-18,,"Main constraints: Site levels and relation to surrounding residential development. Site investigation required.
Summary:  The site is located within settlement development limits and is considered suitable for housing.  There is no evidence that any of this area is available currently but there is a reasonable prospect that any suitable land will be available at a point in the future for development and that development as envisaged will be delivered on the site within 15 years.",7384d83065376a4fcccb0b25c840704e1012b3467420e0a609816540bda3ad17
2017-12-18,local-authority-eng:STO,BR010,"Summerhayes General Stores, The Crescent Cam","https://stroud.maps.arcgis.com/apps/webappviewer/index.html?id=8d2cd204b79c4852b8d4365e24d16013&center=-2.3669096,51.697435&level=17",,not owned by a public authority,not permissioned,,,51.697435,-2.36691,0.11,5,5,2017-12-18,,"Main constraints: Delivery Policy EI3:Small employment sites (outside identified employment areas), Delivery Policy EI6: Protecting individual and village shops, public houses and other community uses 
Summary: The site is located within settlement development limits and is considered to be deliverable for a range of uses, including housing, within 5 years.",7384d83065376a4fcccb0b25c840704e1012b3467420e0a609816540bda3ad17
2017-12-18,local-authority-eng:STO,BR011,"Henlow House/ 54-60 Silver Street, Silver Street Dursley","https://stroud.maps.arcgis.com/apps/webappviewer/index.html?id=8d2cd204b79c4852b8d4365e24d16013&center=-2.3525111,51.680423&level=17",,not owned by a public authority,not permissioned,,,51.680432,-2.352511,0.13,10,10,2017-12-18,,"Main constraints: Dursley Conservation Area, listed buildings, existing uses. Site investigation required.
Summary: The site is considered to be deliverable for housing within five years. The site is available now and it is suitable for for the conversion of existing buildings to housing or commercial uses, with limited new residential infill development to the rear subject to the scale, massing and detailed design of any development reflecting the historic urban grain of Dursley Conservation Area.",7384d83065376a4fcccb0b25c840704e1012b3467420e0a609816540bda3ad17
2017-12-18,local-authority-eng:STO,BR012,"The Old Dairy/ Land off Prospect Place, Dursley","https://stroud.maps.arcgis.com/apps/webappviewer/index.html?id=8d2cd204b79c4852b8d4365e24d16013&center=-2.3555395,51.681142&level=17",,mixed ownership,not permissioned,,,51.681142,-2.35554,0.37,10,10,2017-12-18,,"Main constraints: Town centres and retailing Local Plan Core Policy CP12, Dursley Conservation Area, access, multiple ownership, adjacent listed buildings and protected species. Site investigation required.
Summary: The site is considered to be deliverable for a range of uses including housing within five years. The site is available now and is suitable for redevelopment for housing /town centre uses subject to the scale, massing and detailed design of any development reflecting the historic urban grain of Dursley Conservation Area.",7384d83065376a4fcccb0b25c840704e1012b3467420e0a609816540bda3ad17
2017-12-18,local-authority-eng:STO,BR013,"1-25 Long Street, Dursley","https://stroud.maps.arcgis.com/apps/webappviewer/index.html?id=8d2cd204b79c4852b8d4365e24d16013&center=-2.3537109,51.682199&level=17",,,not permissioned,,,51.682199,-2.353711,0.48,11,11,2017-12-18,,"Main constraints: Town centres and retailing Local Plan Core Policy CP12, Dursley Conservation Area, listed buildings, existing car parking, access and multiple ownership.
Summary: The site is considered suitable for redevelopment for housing/town centre uses subject to the scale, massing and detailed design of any development reflecting the historic urban grain of Dursley Conservation Area. There is no evidence that any of this area is available currently but there is a reasonable prospect that any suitable land will be available at a point in the future for development and that development as envisaged will be delivered on the site within 15 years.",7384d83065376a4fcccb0b25c840704e1012b3467420e0a609816540bda3ad17
2017-12-18,local-authority-eng:STO,BR014,"11/11a May Lane, May Lane Dursley","https://stroud.maps.arcgis.com/apps/webappviewer/index.html?id=8d2cd204b79c4852b8d4365e24d16013&center=-2.3568712,51.681264&level=17",,owned by a public authority,not permissioned,,,51.681264,-2.356871,0.04,5,5,2017-12-18,,"Main constraints: Dursley Conservation Area
Summary:  The site is considered to be deliverable for a range of uses including housing within five years. The site is available now and is considered suitable for housing /community/ town centre uses. Any development should consider the re-use of existing historic buildings. The scale, massing and detailed design of any new infill development will need to reflect the character of Dursley Conservation Area and the setting of neighbouring listed buildings.",7384d83065376a4fcccb0b25c840704e1012b3467420e0a609816540bda3ad17
2017-12-18,local-authority-eng:STO,BR015,"Dursley Garage, 29-31 Kingshill Road Dursley","https://stroud.maps.arcgis.com/apps/webappviewer/index.html?id=8d2cd204b79c4852b8d4365e24d16013&center=-2.3577994,51.683428&level=17",,not owned by a public authority,not permissioned,,,51.683428,-2.357799,0.07,10,10,2017-12-18,,"Main constraints: Existing buildings, access and car parking.
Summary:The site is considered deliverable for housing within five years.  The site is located within settlement development limits, is available now and is suitable for housing development.",7384d83065376a4fcccb0b25c840704e1012b3467420e0a609816540bda3ad17
2017-12-18,local-authority-eng:STO,BR016,"Dockyard Works, Knapp Lane Brimscombe","https://stroud.maps.arcgis.com/apps/webappviewer/index.html?id=8d2cd204b79c4852b8d4365e24d16013&center=-2.1827007,51.717314&level=17",,not owned by a public authority,not permissioned,,,51.717314,-2.182701,1.04,20,20,2017-12-18,,"Main constraints: Dockyard Works Local Plan Site Allocations Policy SA1g; Regenerating existing employment sites Local Plan Delivery Policy EI2 (ER4), Industrial Heritage Conservation Area, demolition of buildings, flood risk. Site investigation required.
Summary: The site is allocated in the Local Plan for mixed use redevelopment and is considered suitable for redevelopment for housing /community development and employment uses. Part of the site is within flood zone 3 and will require de-culverting of the Toadsmoor Stream on-site and the
reinstatement and maintenance of the adjacent Canal channel off-site to reduce flood risk and improve river corridor functionality.  Access will require improvements to the Knapp Lane/Toadsmoor Road/A419 junctions.The site is available now and there is a reasonable prospect that development as envisaged will be delivered on the site within 15 years.",7384d83065376a4fcccb0b25c840704e1012b3467420e0a609816540bda3ad17
2017-12-18,local-authority-eng:STO,BR017,"Val D'Or Works, Knapp Lane Brimscombe","https://stroud.maps.arcgis.com/apps/webappviewer/index.html?id=8d2cd204b79c4852b8d4365e24d16013&center=-2.1803856,51.717542&level=17",,not owned by a public authority,not permissioned,,,51.717551,-2.180386,0.42,10,10,2017-12-18,,"Main constraints: Dockyard Works Local Plan Site Allocations Policy SA1g; Industrial Heritage Conservation Area, demolition of buildings, flood risk. Site investigation required.
Summary: The site is allocated in the Local Plan for mixed use redevelopment and is considered suitable for redevelopment for housing /community development and employment uses.  Part of the site is within flood zone 3 and will require the reinstatement and maintenance of the adjacent Canal channel off-site to reduce flood risk and improve river corridorfunctionality. Access will require improvements to the Knapp Lane/Toadsmoor Road/A419 junctions. The site is not currently available but there is a reasonable prospect that the site will be available in the medium term and that development as envisaged will be delivered on the site within 15 years.",7384d83065376a4fcccb0b25c840704e1012b3467420e0a609816540bda3ad17
2017-12-18,local-authority-eng:STO,BR018,"The New Lawn, Nailsworth, Another Way Nailsworth","https://stroud.maps.arcgis.com/apps/webappviewer/index.html?id=8d2cd204b79c4852b8d4365e24d16013&center=-2.2376382,51.698838&level=17",,not owned by a public authority,not permissioned,,,51.698838,-2.237638,2.83,52,78,2017-12-18,,"Main constraints: Protected outdoor play space. Relocation of Forest Green Football Club
Summary: The site is considered suitable for redevelopment for housing / community development subject to the relocation of the football stadium and community uses providing a net benefit to the community in terms of the quality, availability and accessibility of recreational or open space opportunities. The site is in active use and can only come forward for development once suitable replacement facilities are provided. There is a reasonable prospect that development as envisaged will be delivered on the site within 15 years.",7384d83065376a4fcccb0b25c840704e1012b3467420e0a609816540bda3ad17
2017-12-18,local-authority-eng:STO,BR019,"Daniels Industrial Estate, 104 Bath Road, Stroud","https://stroud.maps.arcgis.com/apps/webappviewer/index.html?id=8d2cd204b79c4852b8d4365e24d16013&center=-2.2335232,51.73704&level=17",,not owned by a public authority,pending decision,,,51.737031,-2.233523,2.52,50,50,2017-12-18,,"Main constraints: Regenerating existing employment sites Local Plan Delivery Policy EI2 (ER7), Industrial Heritage Conservation Area.There are existing businesses on the site. Site investigation required.
Summary: The site is subject to a Development Control Committee resolution, on 21/11/2017, to grant planning permission subject to a s106 agreement relating to affordable housing and off-site highway improvements. The site is considered to be deliverable for a range of uses including housing within five years. The site is allocated in the Local Plan as suitable for mixed use redevelopment, including employment development, provided there are demonstrable environmental and/or conservation benefits. The site is available now and there is a reasonable prospect that development as envisaged will be delivered on the site.",7384d83065376a4fcccb0b25c840704e1012b3467420e0a609816540bda3ad17
2017-12-18,local-authority-eng:STO,BR020,"Fern House and Unit 24 Daniels Industrial Estate, Bath Road, Stroud","https://stroud.maps.arcgis.com/apps/webappviewer/index.html?id=8d2cd204b79c4852b8d4365e24d16013&center=-2.2326276,51.737474&level=17",,not owned by a public authority,not permissioned,,,51.737474,-2.232628,0.45,10,10,2017-12-18,,"Main constraints: Regenerating existing employment sites Local Plan Delivery Policy EI2 (ER7), Industrial Heritage Conservation Area.There are existing businesses on the site. Site investigation required.
Summary: The site is considered to be deliverable for a range of uses including housing within five years. The site is allocated in the Local Plan as suitable for mixed use redevelopment, including employment development, provided there are demonstrable environmental and/or conservation benefits. The site is available now and there is a reasonable prospect that development as envisaged will be delivered on the site.",7384d83065376a4fcccb0b25c840704e1012b3467420e0a609816540bda3ad17
2017-12-18,local-authority-eng:STO,BR021,"Land adjacent to Fromehall, Bath Road Rodborough","https://stroud.maps.arcgis.com/apps/webappviewer/index.html?id=8d2cd204b79c4852b8d4365e24d16013&center=-2.2289435,51.742057&level=17",,,not permissioned,,,51.742057,-2.228943,0.47,5,5,2017-12-18,,"Main constraints: Industrial Heritage Conservation Area, topography, land stability and access. Site investigation required.
Summary: The site is considered suitable for housing or community development. However care will be needed as it contributes to the setting of historic buildings as well as the character of the conservation area. There will be a need to retain mature trees and secure safe access improvements to the local road and cycle network. There is no evidence that any of this area is available currently but there is a reasonable prospect that any suitable land will be available at a point in the future for development and that development as envisaged will be delivered on the site within 15 years.",7384d83065376a4fcccb0b25c840704e1012b3467420e0a609816540bda3ad17
2017-12-18,local-authority-eng:STO,BR022,"Land North Of Dudbridge Hill, Dudbridge Stroud","https://stroud.maps.arcgis.com/apps/webappviewer/index.html?id=8d2cd204b79c4852b8d4365e24d16013&center=-2.2357451,51.74101&level=17",,not owned by a public authority,pending decision,,,51.74101,-2.235745,2.31,31,31,2017-12-18,,"Main constraints: Industrial Heritage Conservation Area, access. Site investigation required.
Summary: The site is considered deliverable for housing within 5 years, in conjunction with adjoining land at Dudbridge Hill, and is available now.",7384d83065376a4fcccb0b25c840704e1012b3467420e0a609816540bda3ad17
2017-12-18,local-authority-eng:STO,BR023,"Former Standish Hospital Site, Horsemarling Lane Standish","https://stroud.maps.arcgis.com/apps/webappviewer/index.html?id=8d2cd204b79c4852b8d4365e24d16013&center=-2.267856,51.7586&level=17",,owned by a public authority,pending decision,,,51.7586,-2.267856,13.07,125,125,2017-12-18,,"Main constraints: A quality living and working countryside (Local Plan Policy CP15); Cotswold AONB; Tree Preservation Orders; Listed Buildings. Site investigation required.
Summary:The site is considered to be deliverable for a range of uses including housing within five years. The site is available now and it is suitable for housing development comprising the  sensitive reuse of the historic buildings with the minimum necessary enabling development in order to secure the long term future of this important heritage asset. A comprehensive masterplan and supporting viability justification would be required.",7384d83065376a4fcccb0b25c840704e1012b3467420e0a609816540bda3ad17
2017-12-18,local-authority-eng:STO,BR024,"Stagholt Playing Field Car Park, Gloucester Road Stonehouse","https://stroud.maps.arcgis.com/apps/webappviewer/index.html?id=8d2cd204b79c4852b8d4365e24d16013&center=-2.282837,51.756299&level=17",,not owned by a public authority,not permissioned,,,51.756299,-2.282837,0.22,5,5,2017-12-18,,"Main constraints: Adjoining settlement development limits; Local housing need (exception sites) Local Plan Delivery Policy HC4; Existing use of site for changing facilities and carpark associated with the adjacent playing field and as an access to adjoining allotments.
Summary:  The site is considered to be deliverable for housing within five years. The site is available now and the southern part of the site is suitable as an exception site  for an affordable housing scheme site, subject to satisfactory replacement of existing changing facilities, car parking and securing appropriate access to adjacent allotments.",7384d83065376a4fcccb0b25c840704e1012b3467420e0a609816540bda3ad17
2017-12-18,local-authority-eng:STO,BR025,"Old Station Yard, Station Road Stonehouse","https://stroud.maps.arcgis.com/apps/webappviewer/index.html?id=8d2cd204b79c4852b8d4365e24d16013&center=-2.2936068,51.745986&level=17",,not owned by a public authority,not permissioned,,,51.745986,-2.293607,0.31,15,15,2017-12-18,,"Main constraints: Industrial Heritage Conservation Area, Stonehouse Neighbourhood Development Plan. Former railway land. Site investigation required.
Summary: The site is considered deliverable for housing within five years. The site is available now and is suitable for housing development.",7384d83065376a4fcccb0b25c840704e1012b3467420e0a609816540bda3ad17
2017-12-18,local-authority-eng:STO,BR026,"Police station/ Magistrates Court, Parliament Street Stroud","https://stroud.maps.arcgis.com/apps/webappviewer/index.html?id=8d2cd204b79c4852b8d4365e24d16013&center=-2.2140855,51.745439&level=17",,owned by a public authority,not permissioned,,,51.745448,-2.214085,0.41,30,45,2017-12-18,,"Main constraints: Stroud Town Centre Neighbourhood Plan Opportunitiy Site Policy ZP6, Conservation Area, demolition of existing building. Site investigation required.
Summary: The site is identified in the Stroud Town Centre Neighbourhood Development Plan as suitable for redevelopment for a mix of uses including retail and/or public service office uses on the ground floor with residential, hotel and/or office uses on upper floors. The current uses are likely to vacate the site in the short to medium term and there is a reasonable prospect that the site will be available in the future  and that development as envisaged will be delivered on the site within 15 years.",7384d83065376a4fcccb0b25c840704e1012b3467420e0a609816540bda3ad17
