entry-date,organisation,site,site-address,site-plan-url,deliverable,ownership,planning-permission-status,planning-permission-type,hazardous-substances,latitude,longitude,hectares,minimum-net-dwellings,maximum-net-dwellings,start-date,end-date,notes,resource
31/12/2017,local-authority-eng:SCA,17SC0001,"""Granta Processors, Mill Lane, Whittlesford, Cambridge, Cambridgeshire, CB22 4XL""",https://gismaps.scambs.gov.uk/connect/analyst/mobile/#/main?mapcfg=BrownFieldRegister_New&queryTable=/NamedTables/SCDC_Brownfieldregister&queryColumn=Site_Reference&queryValues=17SC0001,yes,,permissioned,outline planning permission,,52.114315,0.155241,0.65,16,16,31/12/2017,,Approved 06/05/2014 | Lapses 2 years from the date of Approval of the last Reserved Matters to be approved,d18a5d7db65828f8a84cc7b61f7ddc427e44944cb1ee9e258f80f1f961faebe9
31/12/2017,local-authority-eng:SCA,17SC0002,"""Land to the rear of, 131 The Causeway, Bassingbourn Cum Kneesworth, Royston, Cambridgeshire, SG8 5JB""",https://gismaps.scambs.gov.uk/connect/analyst/mobile/#/main?mapcfg=BrownFieldRegister_New&queryTable=/NamedTables/SCDC_Brownfieldregister&queryColumn=Site_Reference&queryValues=17SC0002,yes,,permissioned,outline planning permission,,52.081691,-0.04421,0.94,20,20,31/12/2017,,Approved 05/11/2015,d18a5d7db65828f8a84cc7b61f7ddc427e44944cb1ee9e258f80f1f961faebe9
31/12/2017,local-authority-eng:SCA,17SC0003,"""The Oaks, Blacksmiths Lane, Shudy Camps, Cambridge, Cambridgeshire, CB21 4RQ""",https://gismaps.scambs.gov.uk/connect/analyst/mobile/#/main?mapcfg=BrownFieldRegister_New&queryTable=/NamedTables/SCDC_Brownfieldregister&queryColumn=Site_Reference&queryValues=17SC0003,yes,,permissioned,full planning permission,,52.075476,0.376576,0.82,1,1,31/12/2017,,Approved 23/03/2015 | Lapse date 22/03/2018,d18a5d7db65828f8a84cc7b61f7ddc427e44944cb1ee9e258f80f1f961faebe9
31/12/2017,local-authority-eng:SCA,17SC0004,"""Bayer CropScience,Hauxton, Cambridgeshire""",https://gismaps.scambs.gov.uk/connect/analyst/mobile/#/main?mapcfg=BrownFieldRegister_New&queryTable=/NamedTables/SCDC_Brownfieldregister&queryColumn=Site_Reference&queryValues=17SC0004,yes,not owned by a public authority,permissioned,other,,52.15169,0.0934,8.76,285,285,31/12/2017,,"""Planning History: Outline planning permission was granted in February 2010 for up to 380 dwellings and other uses. This permission has now lapsed."" | Phase 1 detailed planning permission for 201 dwellings was granted in November 2014 and the development is under construction. | ""Detailed masterplanning of the site has resulted in the site being anticipated to provide 285 dwellings, rather than 380 dwellings as anticipated in the outline planning permission.""",d18a5d7db65828f8a84cc7b61f7ddc427e44944cb1ee9e258f80f1f961faebe9
31/12/2017,local-authority-eng:SCA,17SC0004a,"""Former Bayer Cropscience Site,Cambridge Road, Hauxton, Cambridge, Cambridgeshire, CB22 5HT""",https://gismaps.scambs.gov.uk/connect/analyst/mobile/#/main?mapcfg=BrownFieldRegister_New&queryTable=/NamedTables/SCDC_Brownfieldregister&queryColumn=Site_Reference&queryValues=17SC0004a,yes,,permissioned,reserved matters approval,,52.15117,0.093579,7.24,201,201,31/12/2017,,"Approved 14/11/2014 | ""March 2015: 25 dwellings under construction, 176 dwellings where no construction had started""",d18a5d7db65828f8a84cc7b61f7ddc427e44944cb1ee9e258f80f1f961faebe9
31/12/2017,local-authority-eng:SCA,17SC0005,"""17-19, Bandon Road,Girton, Cambridgeshire, CB3 OLU""",https://gismaps.scambs.gov.uk/connect/analyst/mobile/#/main?mapcfg=BrownFieldRegister_New&queryTable=/NamedTables/SCDC_Brownfieldregister&queryColumn=Site_Reference&queryValues=17SC0005,yes,,permissioned,full planning permission,,52.226015,0.088665,0.34,2,2,31/12/2017,,Approved 12/07/2016 | Lapse date 11/07/2019,d18a5d7db65828f8a84cc7b61f7ddc427e44944cb1ee9e258f80f1f961faebe9
31/12/2017,local-authority-eng:SCA,17SC0006,"""Former CEMEX Cement Works, Barrington Cement Plant, Haslingfield Road, Barrington, Cambridge, Cambridgeshire, CB22 7RQ""",https://gismaps.scambs.gov.uk/connect/analyst/mobile/#/main?mapcfg=BrownFieldRegister_New&queryTable=/NamedTables/SCDC_Brownfieldregister&queryColumn=Site_Reference&queryValues=17SC0006,yes,,permissioned,outline planning permission,,52.129764,0.044141,31.63,220,220,31/12/2017,,"Approved 27/10/2016 | ""Planning Status: resolution to grant planning permission - planning committee in June 2015 gave officers delegated powers to approve the application subject to the prior completion of a s106 agreement""",d18a5d7db65828f8a84cc7b61f7ddc427e44944cb1ee9e258f80f1f961faebe9
31/12/2017,local-authority-eng:SCA,17SC0007,"""Sheepshead Lane, Harston, Cambridgeshire""",https://gismaps.scambs.gov.uk/connect/analyst/mobile/#/main?mapcfg=BrownFieldRegister_New&queryTable=/NamedTables/SCDC_Brownfieldregister&queryColumn=Site_Reference&queryValues=17SC0007,yes,,permissioned,full planning permission,,52.143765,0.083177,0.32,1,1,31/12/2017,,Approved 05/06/2013 | Lasped date June 2016,d18a5d7db65828f8a84cc7b61f7ddc427e44944cb1ee9e258f80f1f961faebe9
31/12/2017,local-authority-eng:SCA,17SC0008,"""Fulbourn & Ida Darwin Hospitals,Fulbourn Old Drift, Cambridgeshire""",https://gismaps.scambs.gov.uk/connect/analyst/mobile/#/main?mapcfg=BrownFieldRegister_New&queryTable=/NamedTables/SCDC_Brownfieldregister&queryColumn=Site_Reference&queryValues=17SC0008,yes,owned by a public authority,permissioned,other,,52.18499,0.18802,26.91,230,230,31/12/2017,,"""Important Note: this site includes both greenfield and brownfield land; the information presented in the 'SiteplanURL', 'Hectares', 'PlanningHistory', 'MinNetDwellings', 'Development Description', 'Non-HousingDevelopment' columns is for whole site and not just the brownfield land"" | ""Planning History: Planning committee in June 2014 endorsed a development brief for the site as a material consideration for all subsequent planning applications"" | Outline planning permission for 180 dwellings and 70 unit extra care facility was refused by planning committee in June 2014 | It is unlikely that the site will be able to accommodate any more than 230 dwellings due to the discussions undertaken in the consideration of the planning application.",d18a5d7db65828f8a84cc7b61f7ddc427e44944cb1ee9e258f80f1f961faebe9
31/12/2017,local-authority-eng:SCA,17SC0008a,"""Ida Darwin Hospital, Fulbourn Old Drift, FULBOURN, CB21 5EE""",https://gismaps.scambs.gov.uk/connect/analyst/mobile/#/main?mapcfg=BrownFieldRegister_New&queryTable=/NamedTables/SCDC_Brownfieldregister&queryColumn=Site_Reference&queryValues=17SC0008a,yes,,permissioned,outline planning permission,,52.18615,0.200671,13.38,203,203,31/12/2017,,"""Outline planning application for up to 203 dwellings including affordable housing and land for community provision with access and associated works, open space and landscaping, following the demolition of existing buildings on site | Lapses 27/02/2020""",d18a5d7db65828f8a84cc7b61f7ddc427e44944cb1ee9e258f80f1f961faebe9
31/12/2017,local-authority-eng:SCA,17SC0009,"""Northstowe, Longstanton Road, Cambridgeshire""",https://gismaps.scambs.gov.uk/connect/analyst/mobile/#/main?mapcfg=BrownFieldRegister_New&queryTable=/NamedTables/SCDC_Brownfieldregister&queryColumn=Site_Reference&queryValues=17SC0009,yes,owned by a public authority,permissioned,other,,52.267471,0.034437,1380.9,10000,10000,31/12/2017,,"""Important Note: this site includes both greenfield and brownfield land; the information presented in the 'SiteplanURL', 'Hectares', 'PlanningHistory', 'MinNetDwellings', 'Development Description', 'Non-HousingDevelopment' columns is for whole site and not just the brownfield land"" | ""Ownership Status: partly public ownership"" | ""Planning History: Northstowe Joint Development Control
Committee in July 2012 endorsed (with some revisions) the site wide masterplan (Development Framework Document) as a material consideration for all subsequent planning applications."" | ""Outline planning permission granted in April 2014 for phase 1 comprising up to 1,500 dwellings, a primary school, a mixed-use local centre, leisure, community, residential institutions, cultural, health, and employment provision including a household recycling centre, recreational space and landscaped areas, and infrastructure works."" | ""Northstowe Joint Development Control Committee in June 2015 resolved to grant outline planning permission for phase 2 (up to 3,500 dwellings, a secondary school, two primary schools, a town centre and sports hub), subject to the prior completion of a s106 agreement. The conditions and s106 agreement were agreed by the Joint Northstowe Development Control Committee in July 2015.""",d18a5d7db65828f8a84cc7b61f7ddc427e44944cb1ee9e258f80f1f961faebe9
31/12/2017,local-authority-eng:SCA,17SC0009a,"""Land to the East of B1050 and Longstanton, West of the Cambridgeshire Guided Busway (CGB) and North of Oakington""",https://gismaps.scambs.gov.uk/connect/analyst/mobile/#/main?mapcfg=BrownFieldRegister_New&queryTable=/NamedTables/SCDC_Brownfieldregister&queryColumn=Site_Reference&queryValues=17SC0009a,yes,,permissioned,outline planning permission,,52.281724,0.063898,63.3,2450,2450,31/12/2017,,"""Important Note: this site includes both greenfield and brownfield land; the information presented in the 'SiteplanURL', 'Hectares', 'PlanningHistory', 'MinNetDwellings', 'Development Description', 'Non-HousingDevelopment' columns is for whole site and not just the brownfield land"" | Approved 09/01/2017 | Whole site housing estimate for 3500 dwellings.",d18a5d7db65828f8a84cc7b61f7ddc427e44944cb1ee9e258f80f1f961faebe9
31/12/2017,local-authority-eng:SCA,17SC0010,"""27, Cambridge Road, Little Abington, Cambridgeshire, CB21 6BL""",https://gismaps.scambs.gov.uk/connect/analyst/mobile/#/main?mapcfg=BrownFieldRegister_New&queryTable=/NamedTables/SCDC_Brownfieldregister&queryColumn=Site_Reference&queryValues=17SC0010,yes,,permissioned,full planning permission,,52.122875,0.234045,0.48,2,2,31/12/2017,,Approved 01/06/2016 | Lapse date 31/05/2019,d18a5d7db65828f8a84cc7b61f7ddc427e44944cb1ee9e258f80f1f961faebe9
31/12/2017,local-authority-eng:SCA,17SC0011,"""1, Horseheath Road, Linton, Cambridge, Cambridgeshire, CB21 4LU""",https://gismaps.scambs.gov.uk/connect/analyst/mobile/#/main?mapcfg=BrownFieldRegister_New&queryTable=/NamedTables/SCDC_Brownfieldregister&queryColumn=Site_Reference&queryValues=17SC0011,yes,,permissioned,outline planning permission,,52.097775,0.287163,0.29,6,6,31/12/2017,,Approved 30/11/2016 | Lapses 2 years from the date of Approval of the last Reserved Matters to be approved,d18a5d7db65828f8a84cc7b61f7ddc427e44944cb1ee9e258f80f1f961faebe9
31/12/2017,local-authority-eng:SCA,17SC0012,"""60, New Road, Guilden Morden, Royston, Cambridgeshire, SG8 0JN""",https://gismaps.scambs.gov.uk/connect/analyst/mobile/#/main?mapcfg=BrownFieldRegister_New&queryTable=/NamedTables/SCDC_Brownfieldregister&queryColumn=Site_Reference&queryValues=17SC0012,yes,,permissioned,full planning permission,,52.084078,-0.126409,0.34,0,0,31/12/2017,,Approved 09/12/2016 | Lapse date 08/12/2019,d18a5d7db65828f8a84cc7b61f7ddc427e44944cb1ee9e258f80f1f961faebe9
31/12/2017,local-authority-eng:SCA,17SC0013,"""15, Comberton Road, Barton, Cambridge, Cambridgeshire, CB23 7BA""",https://gismaps.scambs.gov.uk/connect/analyst/mobile/#/main?mapcfg=BrownFieldRegister_New&queryTable=/NamedTables/SCDC_Brownfieldregister&queryColumn=Site_Reference&queryValues=17SC0013,yes,,permissioned,outline planning permission,,52.183769,0.050903,0.27,2,2,31/12/2017,,Approved 15/02/2016 | Lapses 2 years from the date of Approval of the last Reserved Matters to be approved,d18a5d7db65828f8a84cc7b61f7ddc427e44944cb1ee9e258f80f1f961faebe9
31/12/2017,local-authority-eng:SCA,17SC0014,"""L Abri, Teversham Road, Fulbourn, Cambridge, Cambridgeshire, CB21 5EB""",https://gismaps.scambs.gov.uk/connect/analyst/mobile/#/main?mapcfg=BrownFieldRegister_New&queryTable=/NamedTables/SCDC_Brownfieldregister&queryColumn=Site_Reference&queryValues=17SC0014,yes,,permissioned,full planning permission,,52.188798,0.206727,0.47,0,0,31/12/2017,,Approved 21/09/2016 | Lapse date 20/09/2019,d18a5d7db65828f8a84cc7b61f7ddc427e44944cb1ee9e258f80f1f961faebe9
31/12/2017,local-authority-eng:SCA,17SC0015,"""Land to the east of, Cox's Drove, Fulbourn, CB21 5HE """,https://gismaps.scambs.gov.uk/connect/analyst/mobile/#/main?mapcfg=BrownFieldRegister_New&queryTable=/NamedTables/SCDC_Brownfieldregister&queryColumn=Site_Reference&queryValues=17SC0015,yes,,permissioned,full planning permission,,52.186785,0.21817,0.54,6,6,31/12/2017,,Approved 29/09/2016 | Lapse date 28/09/2019,d18a5d7db65828f8a84cc7b61f7ddc427e44944cb1ee9e258f80f1f961faebe9
31/12/2017,local-authority-eng:SCA,17SC0016,"""The Plant Depot, Church Farm, Gransden Road, Caxton, Cambridge, CB23 3PL""",https://gismaps.scambs.gov.uk/connect/analyst/mobile/#/main?mapcfg=BrownFieldRegister_New&queryTable=/NamedTables/SCDC_Brownfieldregister&queryColumn=Site_Reference&queryValues=17SC0016,yes,,permissioned,full planning permission,,52.203408,-0.101183,0.5,2,2,31/12/2017,,Approved 14/06/2016 | Lapse date 13/06/2019,d18a5d7db65828f8a84cc7b61f7ddc427e44944cb1ee9e258f80f1f961faebe9
31/12/2017,local-authority-eng:SCA,17SC0017,"""The Willows & Highbank, Long Lane, Fowlmere, Royston, Herts, SG8 7TG""",https://gismaps.scambs.gov.uk/connect/analyst/mobile/#/main?mapcfg=BrownFieldRegister_New&queryTable=/NamedTables/SCDC_Brownfieldregister&queryColumn=Site_Reference&queryValues=17SC0017,yes,,permissioned,full planning permission,,52.095751,0.070734,0.48,3,3,31/12/2017,,Approved 24/10/2016 | Lapse date 23/10/2019,d18a5d7db65828f8a84cc7b61f7ddc427e44944cb1ee9e258f80f1f961faebe9
31/12/2017,local-authority-eng:SCA,17SC0018,"""2, Cambridge Road, Milton, Cambridge, Cambridgeshire, CB24 6AW""",https://gismaps.scambs.gov.uk/connect/analyst/mobile/#/main?mapcfg=BrownFieldRegister_New&queryTable=/NamedTables/SCDC_Brownfieldregister&queryColumn=Site_Reference&queryValues=17SC0018,yes,,permissioned,full planning permission,,52.242544,0.159502,0.62,2,2,31/12/2017,,Approved 27/09/2016 | Lapse date 26/09/2019,d18a5d7db65828f8a84cc7b61f7ddc427e44944cb1ee9e258f80f1f961faebe9
31/12/2017,local-authority-eng:SCA,17SC0019,"""Cold Harbour Farm, Willingham Road, OVER, CB24 5EY""",https://gismaps.scambs.gov.uk/connect/analyst/mobile/#/main?mapcfg=BrownFieldRegister_New&queryTable=/NamedTables/SCDC_Brownfieldregister&queryColumn=Site_Reference&queryValues=17SC0019,yes,,permissioned,full planning permission,,52.310158,0.041528,0.67,0,0,31/12/2017,,Approved 04/10/2016 | Lapse date 03/10/2019,d18a5d7db65828f8a84cc7b61f7ddc427e44944cb1ee9e258f80f1f961faebe9
31/12/2017,local-authority-eng:SCA,17SC0020,"""Westwind, Highfields Road, Highfields Caldecote, Caldecote, Cambridge, Cambridgeshire, CB23 7NX""",https://gismaps.scambs.gov.uk/connect/analyst/mobile/#/main?mapcfg=BrownFieldRegister_New&queryTable=/NamedTables/SCDC_Brownfieldregister&queryColumn=Site_Reference&queryValues=17SC0020,yes,,permissioned,full planning permission,,52.216656,-0.016122,0.59,1,1,31/12/2017,,Approved 26/06/2015 | Lapse date 25/06/2018,d18a5d7db65828f8a84cc7b61f7ddc427e44944cb1ee9e258f80f1f961faebe9
31/12/2017,local-authority-eng:SCA,17SC0021,"""40, Church Lane, Cottenham, Cambridge, Cambridgeshire, CB24 8SN""",https://gismaps.scambs.gov.uk/connect/analyst/mobile/#/main?mapcfg=BrownFieldRegister_New&queryTable=/NamedTables/SCDC_Brownfieldregister&queryColumn=Site_Reference&queryValues=17SC0021,yes,,permissioned,full planning permission,,52.294768,0.13387,0.37,1,1,31/12/2017,,Approved 29/02/2016 | Lapse date 28/02/2019,d18a5d7db65828f8a84cc7b61f7ddc427e44944cb1ee9e258f80f1f961faebe9
31/12/2017,local-authority-eng:SCA,17SC0022,"""44, Main Street, Hardwick, Cambridge, Cambridgeshire, CB23 7QS""",https://gismaps.scambs.gov.uk/connect/analyst/mobile/#/main?mapcfg=BrownFieldRegister_New&queryTable=/NamedTables/SCDC_Brownfieldregister&queryColumn=Site_Reference&queryValues=17SC0022,yes,,permissioned,full planning permission,,52.209364,0.007776,0.41,1,1,31/12/2017,,Approved 19/02/2016 | Lapse date 18/02/2019,d18a5d7db65828f8a84cc7b61f7ddc427e44944cb1ee9e258f80f1f961faebe9
31/12/2017,local-authority-eng:SCA,17SC0023,"""Woodstock, 63 , Fowlmere Road, Heydon, Cambridgeshire, SG8 8PZ """,https://gismaps.scambs.gov.uk/connect/analyst/mobile/#/main?mapcfg=BrownFieldRegister_New&queryTable=/NamedTables/SCDC_Brownfieldregister&queryColumn=Site_Reference&queryValues=17SC0023,yes,,permissioned,full planning permission,,52.044548,0.084115,0.4,1,1,31/12/2017,,Approved 17/02/2017 | Lapse date 16/02/2020,d18a5d7db65828f8a84cc7b61f7ddc427e44944cb1ee9e258f80f1f961faebe9
31/12/2017,local-authority-eng:SCA,17SC0024,"""Meadowside Lodge, Olmstead Green, Castle Camps, Cambridge, Cambridgeshire, CB21 4TW""",https://gismaps.scambs.gov.uk/connect/analyst/mobile/#/main?mapcfg=BrownFieldRegister_New&queryTable=/NamedTables/SCDC_Brownfieldregister&queryColumn=Site_Reference&queryValues=17SC0024,yes,,permissioned,full planning permission,,52.043309,0.385033,0.26,0,0,31/12/2017,,Approved 02/11/2016 | Lapse date 01/11/2019,d18a5d7db65828f8a84cc7b61f7ddc427e44944cb1ee9e258f80f1f961faebe9
31/12/2017,local-authority-eng:SCA,17SC0025,"""56 , Park Lane, FEN DRAYTON, CB24 4SW""",https://gismaps.scambs.gov.uk/connect/analyst/mobile/#/main?mapcfg=BrownFieldRegister_New&queryTable=/NamedTables/SCDC_Brownfieldregister&queryColumn=Site_Reference&queryValues=17SC0025,yes,,permissioned,full planning permission,,52.300144,-0.04199,0.33,1,1,31/12/2017,,Approved 17/03/2017 | Lapse date 16/03/2020,d18a5d7db65828f8a84cc7b61f7ddc427e44944cb1ee9e258f80f1f961faebe9
31/12/2017,local-authority-eng:SCA,17SC0026,"""Quy Water, Newmarket Road, Fen Ditton, Cambridge, Cambridgeshire, CB1 9AT """,https://gismaps.scambs.gov.uk/connect/analyst/mobile/#/main?mapcfg=BrownFieldRegister_New&queryTable=/NamedTables/SCDC_Brownfieldregister&queryColumn=Site_Reference&queryValues=17SC0026,yes,,permissioned,full planning permission,,52.212163,0.19736,0.47,0,0,31/12/2017,,Approved 16/02/2017 | Lapse date 15/02/2020,d18a5d7db65828f8a84cc7b61f7ddc427e44944cb1ee9e258f80f1f961faebe9
31/12/2017,local-authority-eng:SCA,17SC0027,"""Cottenham Farm, Broad Lane, Cottenham, Cambs., CB24 8SW""",https://gismaps.scambs.gov.uk/connect/analyst/mobile/#/main?mapcfg=BrownFieldRegister_New&queryTable=/NamedTables/SCDC_Brownfieldregister&queryColumn=Site_Reference&queryValues=17SC0027,yes,,permissioned,full planning permission,,52.29623,0.119568,0.82,0,0,31/12/2017,,Approved 22/09/2015 | Lapse date 21/09/2018,d18a5d7db65828f8a84cc7b61f7ddc427e44944cb1ee9e258f80f1f961faebe9
31/12/2017,local-authority-eng:SCA,17SC0028,"""Land to rear of 4, Mill Courtyard, Steeple Morden, Royston, Cambridgeshire, SG8 0NH""",https://gismaps.scambs.gov.uk/connect/analyst/mobile/#/main?mapcfg=BrownFieldRegister_New&queryTable=/NamedTables/SCDC_Brownfieldregister&queryColumn=Site_Reference&queryValues=17SC0028,yes,,permissioned,full planning permission,,52.062041,-0.128221,0.09,2,2,31/12/2017,,Approved 24/03/2017,d18a5d7db65828f8a84cc7b61f7ddc427e44944cb1ee9e258f80f1f961faebe9
31/12/2017,local-authority-eng:SCA,17SC0029,"""Westfield Orchard,Ashwell Street, Melbourn, Cambridgeshire, SG8 0RS""",https://gismaps.scambs.gov.uk/connect/analyst/mobile/#/main?mapcfg=BrownFieldRegister_New&queryTable=/NamedTables/SCDC_Brownfieldregister&queryColumn=Site_Reference&queryValues=17SC0029,yes,,permissioned,full planning permission,,52.072142,-0.015692,1.26,0,0,31/12/2017,,"""Important Note: this site includes both greenfield and brownfield land; the information presented in the 'SiteplanURL', 'Hectares', 'PlanningHistory', 'MinNetDwellings', 'Development Description', 'Non-HousingDevelopment' columns is for whole site and not just the brownfield land"" | Approved 27/12/2016 | Lapse date 26/12/2020",d18a5d7db65828f8a84cc7b61f7ddc427e44944cb1ee9e258f80f1f961faebe9
31/12/2017,local-authority-eng:SCA,17SC0030,"""Cambridge East, Land North of Newmarket Road, Newmarket Road, Cambridge""",https://gismaps.scambs.gov.uk/connect/analyst/mobile/#/main?mapcfg=BrownFieldRegister_New&queryTable=/NamedTables/SCDC_Brownfieldregister&queryColumn=Site_Reference&queryValues=17SC0030,yes,not owned by a public authority,permissioned,outline planning permission,,52.213355,0.175242,64.51,481,481,31/12/2017,,"""Important Note: this site includes both greenfield and brownfield land; the information presented in the 'SiteplanURL', 'Hectares', 'PlanningHistory', 'MinNetDwellings', 'Development Description', 'Non-HousingDevelopment' columns is for whole site and not just the brownfield land"" | Approved 30/11/2016 | Lapse date 29/11/2019 | ""Up to 1,300 homes, primary school, food store, community facilities, open spaces, landscaping and associated infrastructure and other development"" | https://www.scambs.gov.uk/content/cambridge-east-area-action-plan | ""Development Control Committee (Cambridge Fringe Sites) in April 2016 resolved to approve an outline planning application for up to 1,300 homes, a primary school, food store, community facilities and open spaces.""",d18a5d7db65828f8a84cc7b61f7ddc427e44944cb1ee9e258f80f1f961faebe9
31/12/2017,local-authority-eng:SCA,17SC0031,"""Land at Green End Industrial Estate, Green End, Gamlingay, Gamlingay, Cambridgeshire, SG19 3LX """,https://gismaps.scambs.gov.uk/connect/analyst/mobile/#/main?mapcfg=BrownFieldRegister_New&queryTable=/NamedTables/SCDC_Brownfieldregister&queryColumn=Site_Reference&queryValues=17SC0031,yes,,permissioned,outline planning permission,,52.156651,-0.196794,2.92,90,90,31/12/2017,,Approved 07/12/2016,d18a5d7db65828f8a84cc7b61f7ddc427e44944cb1ee9e258f80f1f961faebe9
