OrganisationURI,SiteReference,SiteNameAddress,GeoX,GeoY,SiteplanURL,Hectares,OwnershipStatus,HazardousSubstances,PlanningStatus,PermissionType,PermissionDate,PlanningHistory,NetDwellingsRangeFrom,NetDwellingsRangeTo,Deliverable,Notes,FirstAddedDate,LastUpdatedDate,EndDate
http://opendatacommunities.org/id/district-council/shepway,,"Land Rear Church And Dwight, Caesars Way, Folkestone, Kent",1.144608,51.094505,,,,,,,,,,,,,,2020-06-25,
http://opendatacommunities.org/id/district-council/shepway,,"Land Adjoining Fairlight Terrace, Lydd Road, New Romney, Kent, TN28 8HE",0.931869,50.985518,,,,,,,,,,,,,,2020-06-25,
http://opendatacommunities.org/id/district-council/shepway,,"11 Littlestone Road, Littlestone, Kent, TN28 8LN",,,,,,,,,,,,,,,,2020-06-25,
http://opendatacommunities.org/id/district-council/shepway,,"Two Bells Inn, 58 Canterbury Road, Folkestone, Kent, CT19 5NJ",1.18468,51.087708,,,,,,,,,,,,,,2020-06-25,
http://opendatacommunities.org/id/district-council/shepway,,"Charlier House, 8-12 Stade Street, Hythe, Kent, CT21 6BE",1.081687,51.069611,,,,,,,,,,,,,,2020-06-25,
http://opendatacommunities.org/id/district-council/shepway,,"12-14 Princess Street, Folkestone, Kent, CT19 6EB",,,,,,,,,,,,,,,,2020-06-25,
http://opendatacommunities.org/id/district-council/shepway,,"The Leas Club, The Leas, Folkestone, Kent, CT19 2DP",1.176797,51.077506,,,,,,,,,,,,,,2020-06-25,
http://opendatacommunities.org/id/district-council/shepway,,"72 Cheriton High Street, Folkestone, Kent, CT19 4HF",,,,,,,,,,,,,,,,2020-06-25,
http://opendatacommunities.org/id/district-council/shepway,,"52-54 Guildhall Street, Folkestone, Kent, CT20 1EE",,,,,,,,,,,,,,,,2020-06-25,
http://opendatacommunities.org/id/district-council/shepway,,"Folkestone Constitutional Club, 43-45 Guildhall Street, Folkestone, Kent CT20 1EF",1.178382,51.081259,,,,,,,,,,,,,,2020-06-25,
http://opendatacommunities.org/id/district-council/shepway,,"116 Cheriton Road, Folkestone, Kent, CT19 5HQ",1.16616,51.083794,,,,,,,,,,,,,,2020-06-25,
http://opendatacommunities.org/id/district-council/shepway,,"Squirrels, Cannongate Road, Hythe, Kent, CT21 5PT",1.093897,51.074577,,,,,,,,,,,,,,2020-06-25,
http://opendatacommunities.org/id/district-council/shepway,,"Shakespeare Centre, 145-147 Sandgate Road, Folkestone, Kent, CT20 2DA",,,,,,,,,,,,,,,,2020-06-25,
http://opendatacommunities.org/id/district-council/shepway,,"The Paddocks, 13 Prospect Road, Hythe, Kent, CT21 5NN, (Land Adjoining The Paddocks Car Park, Prospect Road, Hythe, Kent)",1.085218,51.07075,,,,,,,,,,,,,,2020-06-25,
http://opendatacommunities.org/id/district-council/shepway,,"124 Sandgate High Street, Sandgate, Folkestone, Kent, CT20 3BZ",,,,,,,,,,,,,,,,2020-06-25,
http://opendatacommunities.org/id/district-council/shepway,,"58-60 & 62 Shorncliffe Road, Folkestone, Kent, CT20 2NQ",1.153204,51.080187,,,,,,,,,,,,,,2020-06-25,
http://opendatacommunities.org/id/district-council/shepway,,"12 Jointon Road, Folkestone, Kent, CT20 2RG",1.16556,51.07961,,,,,,,,,,,,,,2020-06-25,
http://opendatacommunities.org/id/district-council/shepway,,"5 Trinity Crescent, Folkestone, Kent, CT20 2ES",1.167126,51.075997,,,,,,,,,,,,,,2020-06-25,
http://opendatacommunities.org/id/district-council/shepway,,"East Station Goods Yard, Southern Way, Folkestone, Kent",1.18865,51.086034,,,,,,,,,,,,,,2020-06-25,
http://opendatacommunities.org/id/district-council/shepway,,"Harbour Community Church, Harvey Street, Folkestone, Kent, CT20 1LH",,,,,,,,,,,,,,,,2020-06-25,
http://opendatacommunities.org/id/district-council/shepway,,"Coach Depot, King Street, Brenzett, Kent, TN29 9UD",,,,,,,,,,,,,,,,2020-06-25,
http://opendatacommunities.org/id/district-council/shepway,,"Former Rotunda Amusement Park, Marine Parade, Folkestone, Kent",1.185134,51.076856,,,,,,,,,,,,,,2020-06-25,
http://opendatacommunities.org/id/district-council/shepway,,"Shepway Resource Centre, Military Road, Folkestone, Kent, CT20 3SP",1.140235,51.079718,,,,,,,,,,,,,,2020-06-25,
http://opendatacommunities.org/id/district-council/shepway,,"Stoneleigh House, Tram Road, Folkestone, Kent, CT20 1QS",,,,,,,,,,,,,,,,2020-06-25,
http://opendatacommunities.org/id/district-council/shepway,,"Former Officers Mess, Aerodrome Road, Hawkinge",1.149033,51.112735,,,,,,,,,,,,,,2020-06-25,
http://opendatacommunities.org/id/district-council/shepway,,"11 Tontine Street, Folkestone, Kent, CT20 1JT",1.184484,51.08049,,,,,,,,,,,,,,2020-06-25,
http://opendatacommunities.org/id/district-council/shepway,,"Land Adjoining Sir John Moore, Barracks, Military Road, Sandgate, Kent",1.143952,51.076407,,,,,,,,,,,,,,2020-06-25,
http://opendatacommunities.org/id/district-council/shepway,,"The Royal Victoria Hospital, Radnor Park Avenue",,,,,,,,,,,,,,,,2020-06-25,
http://opendatacommunities.org/id/district-council/shepway,,"3-5 Shorncliffe Road, Folekstone",,,,,,,,,,,,,,,,2020-06-25,
http://opendatacommunities.org/id/district-council/shepway,,"Former Gas Works, Ship Street, Folkestone",,,,,,,,,,,,,,,,2020-06-25,
http://opendatacommunities.org/id/district-council/shepway,,"Highview School, Moat Farm Road",,,,,,,,,,,,,,,,2020-06-25,
http://opendatacommunities.org/id/district-council/shepway,,"Brockman Family Centre, Cheriton",,,,,,,,,,,,,,,,2020-06-25,
http://opendatacommunities.org/id/district-council/shepway,,"The Cherry Pickers Public House, Cheriton",,,,,,,,,,,,,,,,2020-06-25,
http://opendatacommunities.org/id/district-council/shepway,,"Affinity Water, Shearway Road, Cheriton",,,,,,,,,,,,,,,,2020-06-25,
http://opendatacommunities.org/id/district-council/shepway,,"Encombe House, Sandgate",,,,,,,,,,,,,,,,2020-06-25,
http://opendatacommunities.org/id/district-council/shepway,,"Smiths Medical Campus, Hythe",,,,,,,,,,,,,,,,2020-06-25,
http://opendatacommunities.org/id/district-council/shepway,,"St Saviour's Hosptial, Seabrook, Road, Hythe",,,,,,,,,,,,,,,,2020-06-25,
http://opendatacommunities.org/id/district-council/shepway,,"Foxwood School, Seabrook Road, Hythe",,,,,,,,,,,,,,,,2020-06-25,
http://opendatacommunities.org/id/district-council/shepway,,"Hythe Swimming Pool, Hythe",,,,,,,,,,,,,,,,2020-06-25,
http://opendatacommunities.org/id/district-council/shepway,,"Land rear of the Old School House, Church Lane, New Romney",,,,,,,,,,,,,,,,2020-06-25,
http://opendatacommunities.org/id/district-council/shepway,,"Station Yard, Station Road, Lydd",,,,,,,,,,,,,,,,2020-06-25,
http://opendatacommunities.org/id/district-council/shepway,,"Former Sands Motel, land adjoining, pumping station, Dymchurch Road, St Mary's Bay",,,,,,,,,,,,,,,,2020-06-25,
http://opendatacommunities.org/id/district-council/shepway,,"Land rear of Varne Boat Club, Coast Drive, Greatstone",,,,,,,,,,,,,,,,2020-06-25,
http://opendatacommunities.org/id/district-council/shepway,,"Car park, Coast Drive, Greatstone",,,,,,,,,,,,,,,,2020-06-25,
http://opendatacommunities.org/id/district-council/shepway,,"The Old Slaughterhouse, Rosemary, Corner, Brookland",,,,,,,,,,,,,,,,2020-06-25,
http://opendatacommunities.org/id/district-council/shepway,,"Land adjacent Kent Battle of Britain Museum, Aerodrome Road, Hawkinge",,,,,,,,,,,,,,,,2020-06-25,
http://opendatacommunities.org/id/district-council/shepway,,"General Sellindge policy, (Silver Spray site)",,,,,,,,,,,,,,,,2020-06-25,
http://opendatacommunities.org/id/district-council/shepway,,"Etchinghill Nursery, Etchinghill",,,,,,,,,,,,,,,,2020-06-25,
